title,source,bias
Obama Takes Early Leap Into Campaign Fray,New York Times - News,left
"Candidates Racing for Future, Gaze Fixed Firmly on the Past",New York Times - News,left
Saving What’s Left of Utah’s Lost World,New York Times - News,left
Campaigns Brace to Sue for Votes in Crucial States,New York Times - News,left
Trump’s Next Move on Health Care? Choice for Secretary May Offer Clue,New York Times - News,left
Gov. John Kitzhaber of Oregon and His Fiancée Walked Tangled Path to Exit,New York Times - News,left
Hillary Clinton and Bernie Sanders Battle for Party's Future,New York Times - News,left
Sotomayor Finds Her Voice Among Justices,New York Times - News,left
Europe condemns the U.S. travel ban as more nations add restrictions.,New York Times - News,left
How G.O.P. Leaders Came to View Climate Change as Fake Science,New York Times - News,left
The State of the Union and the Minimum Wage,New York Times - News,left
Romney May Be Nominated Early ,New York Times - News,left
Next Challenge for the Health Law: Getting the Public to Buy In ,New York Times - News,left
"After Weekend of Attacks, Romney Campaign Shields Itself With Polls ",New York Times - News,left
"Investigating Donald Trump, F.B.I. Sees No Clear Link to Russia",New York Times - News,left
The Global Machine Behind the Rise of Far-Right Nationalism,New York Times - News,left
Obama Pursuing Climate Accord in Lieu of Treaty,New York Times - News,left
Bernie Sanders Attacks Hillary Clinton Directly on Trade Deal,New York Times - News,left
"A Top Republican Vows a Vote on Health Care, but Uncertainty Reigns",New York Times - News,left
Elder Bush Says His Son Was Served Badly by Aides,New York Times - News,left
Crucial Rule Is Delayed a Year for Obama's Health Law,New York Times - News,left
Chances of China Trade Win Undercut by Trump Team Infighting,New York Times - News,left
Donald Trump’s Income and Wealth Are Shown in Filing but Are Hard to Pinpoint  Photo,New York Times - News,left
Conservatives Push Romney to Deliver Counterpunch ,New York Times - News,left
"Backing Off Deal, Boehner Invokes Ã¢â‚¬ËœPlan BÃ¢â‚¬â„¢ on Taxes",New York Times - News,left
The Deeper Blame for Benghazi,New York Times - News,left
"Republicans Move to Block Impeachment Witnesses, Driving Toward Acquittal",New York Times - News,left
White House Tries to Tamp Down Trade War Fears as China Retaliates,New York Times - News,left
OPINION: Trump’s Sabotage of Obamacare Is Illegal,New York Times - News,left
Trump’s Attempt to Circumvent Congress Leaves Uneasy Senate Republicans With Hard Choice,New York Times - News,left
Obama's Plan Aims to Lower Cost of College,New York Times - News,left
"Struggling in Congress, Republicans Unite on Foreign Policy",New York Times - News,left
The Recovery Threw the Middle-Class Dream Under a Benz,New York Times - News,left
OPINION: Trump and His Lawyers Embrace a Vision of Vast Executive Power,New York Times - News,left
"Two Giant Banks, Seen as Immune, Become Targets",New York Times - News,left
"For Secretary of State, G.O.P. Pushes Old Hand",New York Times - News,left
"Make Room for God, Pope Says at Christmas Eve Mass",New York Times - News,left
"New Sea Drilling Rule Planned, 5 Years After BP Oil Spill",New York Times - News,left
Trump’s Speech to Congress: Video and Transcript,New York Times - News,left
"After a Gunslinger Cuts Loose, Romney Aides Take Cover",New York Times - News,left
Bush and C.I.A. Ex-Officials Rebut Torture Report,New York Times - News,left
"Before the G.O.P. Convention, a Romney To-Do List ",New York Times - News,left
"Theresa May, Despite U.K. Election Setback, Will Form a Minority Government",New York Times - News,left
Hillary Clinton Bets on Future With Spending Spree to Build Campaign Infrastructure,New York Times - News,left
White House to Keep Its Visitor Logs Secret,New York Times - News,left
"Candidates Have College, Spicy Chicken and Ã¢â‚¬ËœStar TrekÃ¢â‚¬â„¢ in Common",New York Times - News,left
New Species of Human Ancestor Is Found in a South African Cave,New York Times - News,left
N.S.A. Devises Radio Pathway Into Computers,New York Times - News,left
Akin Defies Calls to Step Down in TV Interviews ,New York Times - News,left
The Best Way to Vilify Hillary Clinton? G.O.P. Spends Heavily to Test It,New York Times - News,left
The President on Inequality,New York Times - News,left
"As Fiscal Talks Heat Up, Questions on Whether Boehner Can Get the Votes",New York Times - News,left
"More Young Adults Have Insurance After Health Care Law, Study Says",New York Times - News,left
Automatic Tax Increases Could Stunt Economy's Growth in 2013,New York Times - News,left
OPINION: Tough Talk and a Cowardly Vote on Terrorism,New York Times - News,left
Obama Proposes Single Overseer for Food Safety,New York Times - News,left
"With Iran Deal in Hand, White House Makes Sales Pitch to Preserve It",New York Times - News,left
Pentagon in Back Seat as Kerry Leads Charge,New York Times - News,left
Boehner Gains Strong Backing From House Republicans,New York Times - News,left
Background on Same-Sex Marriage Case at Supreme Court,New York Times - News,left
North Carolina Law May Risk Federal Aid,New York Times - News,left
"For Scott Walker, a Consistent Approach Under Tough Questioning",New York Times - News,left
Commerce Secretary Takes Medical Leave After Hit-and-Run Crash ,New York Times - News,left
The Conservative Future,New York Times - News,left
Supreme Court Upholds Trump’s Travel Ban,New York Times - News,left
Flood of Briefs on the Health Care Law’s Subsidies Hits the Supreme Court,New York Times - News,left
"Christie Roams, and Popularity Suffers at Home",New York Times - News,left
House Defeats Effort to Rein In N.S.A. Data Gathering,New York Times - News,left
Job Weakness Starts to Shape Election Tone,New York Times - News,left
"As Campaigns Seek Delegates, Ordinary Voters Feel Sidelined",New York Times - News,left
"After Week of Infighting, Democrats Wonder Where to Draw Line on Speech",New York Times - News,left
Romney Comments on Palestinians Draw Criticism,New York Times - News,left
Conservative Leads Effort to Raise Minimum Wage in California,New York Times - News,left
"In WashingtonÃ¢â‚¬â„¢s New Mood of Austerity, Legislating Turns Into a Zero-Sum Game ",New York Times - News,left
Health Care Under Romney: The Status Quo Ante ,New York Times - News,left
Outside Money Drives a Deluge of Political Ads,New York Times - News,left
Ted Cruz’s New Data Strategy: Here Comes Santa Claus,New York Times - News,left
Bernie Sanders Falls Behind in a Race Centered on Security,New York Times - News,left
Israel Girds for Ground Assault in Gaza; EgyptÃ¢â‚¬â„¢s Premier Visits,New York Times - News,left
Obama's Evolving Doctrine,New York Times - News,left
Trump Backs Away from Further Military Conflict With Iran,New York Times - News,left
"Andrew McCabe, a Target of Trump’s F.B.I. Scorn, Is Fired Over Candor Questions",New York Times - News,left
A Holiday Week in a Tough Campaign ,New York Times - News,left
It’s Official: Budget Deficit Falls to Pre-Recession Levels,New York Times - News,left
Tensions Rise in Syria as Israel Is Accused of Bombing Air Base,New York Times - News,left
McConnell’s Reputation as a Master Tactician Takes a Hit,New York Times - News,left
OPINION: The Collapse of the Secret Service,New York Times - News,left
Aides for Hillary Clinton and Benghazi Committee Dispute Testimony Plan,New York Times - News,left
Advice From a Crisis Expert on Surviving a Lockdown,New York Times - News,left
"Support Waning, Romney Decides Against 2016 Bid",New York Times - News,left
Two Legal Teams With Contrasting Strategies Face Off in the Capitol,New York Times - News,left
"Zuckerberg, Facing Facebook’s Worst Crisis Yet, Pledges Better Privacy",New York Times - News,left
Sondland Kept Pompeo Informed on Ukraine Pressure Campaign,New York Times - News,left
Bernie Sanders Announces He Is Running for President,New York Times - News,left
G.O.P. Is Vague on Using Power Abroad,New York Times - News,left
"Mueller Won’t Indict Trump if He Finds Wrongdoing, Giuliani Says",New York Times - News,left
"Wisconsin Goes to Cruz, Raising Chance of Fight at Convention",New York Times - News,left
Kansas and Ohio Races Remain Too Close to Call,New York Times - News,left
Brett Kavanaugh Testimony: Three Inconsistencies the F.B.I. Investigation Could Address,New York Times - News,left
"As World Boils, Fingers Point Obama’s Way",New York Times - News,left
Jobs Report Brings Unexpected Good News for Obama,New York Times - News,left
"Kelly, in Defending Trump Call, Holds Up Military as an Elite Class",New York Times - News,left
Political Pitfalls Litter Any Path Obama May Take for Court,New York Times - News,left
Ohio Governor Defies G.O.P. With Defense of Social Safety Net,New York Times - News,left
Alabama Senate Race Between Roy Moore and Doug Jones Ends With More Controversy,New York Times - News,left
Obama Consoles Aurora as City Begins Healing,New York Times - News,left
U.S. Weighs Bolder Effort to Intervene in SyriaÃ¢â‚¬â„¢s Conflict ,New York Times - News,left
Health Care Entitlements,New York Times - News,left
John McCain Demands Donald Trump Make Amends to Veterans,New York Times - News,left
Trump’s Freewheeling and Fact-Free Cabinet Meeting,New York Times - News,left
Providing Balanced Information Is Not Facebook’s Goal,New York Times - News,left
Has the ‘Libertarian Moment’ Finally Arrived?,New York Times - News,left
White House Withholds 20 Emails Between Two Trump Aides on Ukraine Aid,New York Times - News,left
Elizabeth Warren Raises $8.67 Million for Massachusetts Senate Race ,New York Times - News,left
A Legacy in the Balance on Surveillance Policies,New York Times - News,left
OPINIONS: Keeping Ebola at Bay,New York Times - News,left
Teachers in Chicago Will Strike After Talks Collapse,New York Times - News,left
"Trump Condemns ‘Alleged Leaks,’ After Complaints From Britain",New York Times - News,left
How Nonemployed Americans Spend Their Weekdays: Men vs. Women,New York Times - News,left
Trump to Sign Order Targeting Anti-Semitism on College Campuses,New York Times - News,left
OPINION: Climate of Complete Certainty,New York Times - News,left
Suspects Seemed Set for Attacks Beyond Boston,New York Times - News,left
Trump Goes All In on a Tax Overhaul Whose Details Remain Unwritten,New York Times - News,left
Whistle-Blower Tells Congress of Irregularities in White House Security Clearances,New York Times - News,left
Justin Fairfax Puts Virginia Democrats in Bind on Impeachment,New York Times - News,left
U.S. Workers Are Grounded by Deep Cuts,New York Times - News,left
How Liberals Got Lost on the Story of Missing Children at the Border,New York Times - News,left
OPINION: Democrats Can Win on Immigration,New York Times - News,left
‘Fired Up’ Voters in 18 States Are Outpacing 2014 Early Ballot Counts,New York Times - News,left
OPINION: Trump’s Backward View of Immigration,New York Times - News,left
"Amid Mideast Turmoil, Aides Say What a President Romney Would Do ",New York Times - News,left
Groups That Back Bloomberg’s Education Agenda Enjoy Success in Albany,New York Times - News,left
Kerry Opens Door to Iran’s Participation in Syrian Peace Talks,New York Times - News,left
No Rest for the Wary: First Family’s Needs Strain Secret Service,New York Times - News,left
Obama Considers Expanding Support for Syrian Rebels,New York Times - News,left
No to Keystone. Yes to Crazy.,New York Times - News,left
An Obamacare gotcha moment,Politico,left
What to watch in Pennsylvania,Politico,left
Horowitz pushes back at Barr over basis for Trump-Russia probe,Politico,left
2016 cash race: It’s on,Politico,left
Furious GOP donors stew over Trump,Politico,left
Trump vs. Clinton is the 1980s vs. the 1990s ,Politico,left
Sanders says he's not interested in asking Hillary Clinton for 2020 advice,Politico,left
Supreme Court agrees to hear cases on contraceptive mandate,Politico,left
We talked to experts on aging about the 2020 field. Here’s what they told us.,Politico,left
"Despite hype, House still hasn’t sued Obama",Politico,left
New GOP Congress confronts a crushing to-do list,Politico,left
Battleground Poll: Mitt more likable ,Politico,left
Vitter's Obamacare crusade draws GOP ire,Politico,left
McCarthy's ascent,Politico,left
Jack Lew takes on debt deniers,Politico,left
States want more time on ACA funds,Politico,left
Does Obama deserve credit for the economy?,Politico,left
10 Maps That Explain the 2014 Midterms,Politico,left
The return of Corey Lewandowski,Politico,left
Zombie economy threatens Obama,Politico,left
House GOP thinks unthinkable on defense cuts,Politico,left
House approves VA reform bill,Politico,left
Why the Iraq Offensive Will Fail,Politico,left
The Real ‘Resistance’ to Trump? The GOP Congress.,Politico,left
The Senate's Scrooge session,Politico,left
Senate advances border bill,Politico,left
Can GOP manage the mic in Tampa? ,Politico,left
GOP’s Obamacare fears come true,Politico,left
"Paul backs Pompeo, ensuring confirmation as secretary of state",Politico,left
POLITICO poll shows mounting danger for Dems,Politico,left
Farmers: Trump 'terrible for agriculture',Politico,left
Battleground Poll: Race still tight,Politico,left
Flynn's White House influence is outliving his short tenure,Politico,left
Hillary’s emails: Deleted but not gone,Politico,left
Iran deal a big test for Schumer,Politico,left
Trump fails to impress foreign-policy experts,Politico,left
Marco Rubio stumbles,Politico,left
Jeb in the Wilderness,Politico,left
Iran talks complicate U.S. push on Israeli-Palestinian negotiations ,Politico,left
How Perdue’s power benefits his friends,Politico,left
President Obama to propose ending sequester,Politico,left
Rick Snyder vetoes voter ID bills ,Politico,left
Perry hits Clinton for dissing Texas on voter IDs  ,Politico,left
Ted Cruz’s Hail Carly pass,Politico,left
Trump again pushes claim FBI informant planted for political purposes,Politico,left
"Google, Facebook may have to reveal deepest secrets",Politico,left
Trump careens toward a Christmas crisis with North Korea,Politico,left
DOD Ebola fight could last a year or more ,Politico,left
House Obamacare repeal DOA in the Senate,Politico,left
Is the Senate really working?,Politico,left
Clinton's third-party headache,Politico,left
President Obama's messy breakup with insurers,Politico,left
GOP establishment stares into the abyss,Politico,left
Video potential worry for Obama campaign,Politico,left
Shaun McCutcheon: Campaign spending caps hurt democracy,Politico,left
How Trump saved Kavanaugh,Politico,left
How Planned Parenthood could shut down the government,Politico,left
GOTCHA! How oppo took over the midterms,Politico,left
Trump delivers another blow to Fox News: 'Fox isn’t working for us anymore!',Politico,left
"Ivanka Trump, climate czar?",Politico,left
Opinion: We need a new Voting Rights Act,Politico,left
White House defends Benghazi email,Politico,left
Politics could dictate who gets a coronavirus vaccine,Politico,left
Obamacare vs. ACA: What's in a name?,Politico,left
Reince Priebus and the debate season from hell,Politico,left
Ann Romney's RNC task: Humanize Mitt,Politico,left
How Mitt Romney would govern,Politico,left
Cruz and Kasich team up to stop Trump,Politico,left
Chris Christie's weeklong train wreck,Politico,left
"1 week, 2 versions of reality",Politico,left
Ryan and McConnell confront their first big test,Politico,left
Collins: New justice should not favor overturning Roe v. Wade,Politico,left
"The auto industry faces challenges worse than in 2008, lawmakers say",Politico,left
"House passes funding for energy, VA, military projects",Politico,left
Democratic elite rally around Hillary Clinton,Politico,left
Mythbusters,Politico,left
Senate GOP leaving tea party primary battles behind,Politico,left
White House determined not to give ground on Obamacare,Politico,left
Why President Obama's Syria speech won't matter,Politico,left
Fiscal cliff: Will they jump? ,Politico,left
The New Hampshire GOP summit: 6 takeaways,Politico,left
Senate vote-a-rama: A charade with consequences,Politico,left
Fate of Planned Parenthood funding tied to Senate moderates,Politico,left
Roger Stone faces a gag order. He has a plan to resist it.,Politico,left
A letter from Black America,Politico,left
Biden makes sharp pivot toward Latino vote,Politico,left
Syria chemical weapons: President Obama's forced hand,Politico,left
House Dems make Clinton 2016 pitch,Politico,left
America's 100 Other Declarations of Independence,Politico,left
Papadopoulos: I was 'pinned' in FBI interview,Politico,left
House GOP moves toward Export-Import Bank deal,Politico,left
Rival campaigns starting to fear Ted Cruz,Politico,left
‘This is an earthquake’: Virginia GOP celebrates Dems’ implosion,Politico,left
Senate talks going nuclear,Politico,left
Attorney General Eric Holder moves to rein in mandatory minimum sentences,Politico,left
Donald Trump's very white convention,Politico,left
Inside the swing-state playbooks,Politico,left
GOP plots to prevent more Todd Akins,Politico,left
Boston's unanswered questions,Politico,left
2016 contenders off and running in the money race,Politico,left
Obamacare mandate may be Ã¢â‚¬Ëœmandate plusÃ¢â‚¬â„¢ ,Politico,left
Tax Day: Not as bad as expected,Politico,left
White House denies backtracking on Paris pact withdrawal,Politico,left
Louisiana’s Common Core Debacle,Politico,left
Democrats gird for defections on Obamacare vote,Politico,left
'A major player': Sanders gets props from the Democratic establishment,Politico,left
Trump goes for 5-state sweep,Politico,left
GOP cries foul after California thumping,Politico,left
Opinion: After the midterms: Democrats fear President Obama could give in,Politico,left
Did Obama Blow It on the Russian Hacking?,Politico,left
Idaho ban on gay marriage struck down,Politico,left
Downsizing the dream,Politico,left
At stake in immigration debate: Billions of dollars,Politico,left
Fiscal cliff deal increasingly unlikely,Politico,left
Citizenship and immigration services chief resigns,Politico,left
Behind the Curtain: Newtown families: Victims turn lobbyists,Politico,left
Trump signs transgender military ban,Politico,left
The People Who Pick The President,Politico,left
"As deadline nears, ticking clock on Democratic patience ",Politico,left
Bernie Sanders vs. the Lamestream Media,Politico,left
Waiting for Obama,Politico,left
Chinese hackers access data of 4 million federal employees,Politico,left
President Obama and Chris Christie: A Sandy love story,Politico,left
Is President Obama serious about a grand bargain?,Politico,left
Trump panic drives progressives toward Clinton,Politico,left
Senate Democrats press House on immigration,Politico,left
The search for a non-awkward Obamacare shout-out  ,Politico,left
Sanders: Clinton's not qualified to be president,Politico,left
Obama’s last chance on defense,Politico,left
Louisiana delivers Trump a black eye,Politico,left
The Democrats’ Dilemma,Politico,left
President Obama: Supreme Court made 'mistake' on voting rights,Politico,left
"Hawaii primary: Abercrombie ousted, Schatz slightly ahead",Politico,left
Climate lessons from the Clinton campaign's hacked emails,Politico,left
Senate GOP engaged in budget battle,Politico,left
Mitt RomneyÃ¢â‚¬â„¢s top political adviser: Mitt Romney,Politico,left
Media Matters’ David Brock expands empire,Politico,left
An Obamacare October surprise?,Politico,left
Immigration reform's other hurdle,Politico,left
'Historic' climate deal in sight as nations parse final text ,Politico,left
A few legal scholars put health care on brink,Politico,left
Trade to see big year in 2015,Politico,left
The Obamacare bailout battle,Politico,left
Trump keeps America in suspense,Politico,left
"‘Corn, soybeans and landmines’: Dems sweat early state blunders",Politico,left
"Democrats to Obama: You broke the party, now fix it  ",Politico,left
Trump blows off debate tune-up,Politico,left
12 most heated moments in an unprecedented debate ,Politico,left
Ted Cruz’s Judgment Day,Politico,left
Grover Norquist to Peter King: Don’t be a ‘weasel',Politico,left
President Obama's options on gun control,Politico,left
Chuck Hagel pick: Final snub of George W. Bush,Politico,left
Democrats outraged by Trump ban on info requests,Politico,left
Twinkie insanity hits the House,Politico,left
How Trump gets his fake news,Politico,left
Medicaid ruling could give red states more bargaining power,Politico,left
Biden jolts Dem fight for big donors,Politico,left
Michele Bachmann retiring under fire,Politico,left
"Plagued by stock trades, Loeffler vows she won't drop out",Politico,left
Did Gary Johnson Just Get Boxed Out of the Debates? ,Politico,left
Republicans ponder painful way forward,Politico,left
How Cruz got from 'vote your conscience' to 'vote for Trump' ,Politico,left
Alabama GOP: Sessions not guaranteed to win back his old seat,Politico,left
How low can Trump go in the polls?,Politico,left
Tillerson heads to U.N. gathering with Haley waiting in the wings,Politico,left
Trump prepares to bypass Congress to take on Iran,Politico,left
Trump names his White House communications team,Politico,left
The limits of President Obama's power on NSA reform,Politico,left
"With eyes on Hillary Clinton, Democrats fight to maintain digital edge",Politico,left
The Trouble with TikTok,Politico,left
5 things to watch in VP debate,Politico,left
Barack Obama and Nelson Mandela: Inspiration from afar  ,Politico,left
5 things to watch in tonight’s GOP debate,Politico,left
"POLITICO's Election Forecast: Trump, Senate GOP in trouble",Politico,left
The 2020 Democrat who may actually know how to fix health care,Politico,left
Romney intensifies EPA attacks,Politico,left
VA moves Bernie Sanders from stage left to center stage,Politico,left
Israel hawks to Pope Francis: Stay out of politics  Read more: http://www.politico.com/story/2015/05/israel-hawks-to-pop-francis-stay-out-of-politics-117929.html#ixzz3a8YDrFCj,Politico,left
GOP ready for any entitlements victory,Politico,left
Plouffe to Clinton: Stop micromanaging,Politico,left
Christie to Republicans afraid of town halls: ‘Welcome to the real world of responsibility’,Politico,left
Opinion: Why Democrats might reject Hillary Clinton in 2016,Politico,left
Rush Limbaugh may leave Cumulus,Politico,left
Trump fires defiant acting attorney general,Politico,left
‘Turn Texas blue’ hits headwinds with abortion,Politico,left
Senate advances farm bill,Politico,left
President Obama plays the campaign calendar blues,Politico,left
The Democrats' lost decade?,Politico,left
Obama strikes cautious balance on Egypt,Politico,left
Trump asks Congress to fix Iran deal’s flaws,Politico,left
Billions over budget. Two years after deadline. What's gone wrong for the clean coal project that's supposed to save an industry?,Politico,left
Man on a Wire: Mike Pence’s Tightrope Act,Politico,left
5 unmet promises of President Obama,Politico,left
Will cheap oil kill Keystone?,Politico,left
Pentagon opens investigation into media leaks amid Russian bounty reports,Politico,left
Could undecided voters swing the election?,Politico,left
Meet The Senator Tasked With Keeping Rebellious Republicans In Line,Politico,left
Obama slams GOP’s ‘doom and despair’ on economy ,Politico,left
‘He’s going through a pretty rough time’: Avenatti crashes and burns,Politico,left
Greens move to heal immigration rift,Politico,left
"Intolerance: Oh, So This Is Why Around Half Of Liberals Can't Stand Being Around Trump Supporters",Townhall,right
"Swing State Polls: All Tied Up in Battlegrounds, Including...Texas?",Townhall,right
Little Doubt Remains: Ben Carson Is Running for President,Townhall,right
Jeff Flake Compares Trump to Joseph Stalin,Townhall,right
Surge: Trump Bounces to Best Economic Approval Yet in...CNN Poll,Townhall,right
"Oh, Here We Go: Jeff Flake Holding Up Trump's Judicial Nominees Until Senate Votes On Bill Protecting Mueller Probe",Townhall,right
"Despite Bad Samples, Romney Pulls Closer in Swing State Q-Polls",Townhall,right
Wait–Are Black Women Leaving The Democratic Party?,Townhall,right
OPINION: The Liberal Media's Double Standard,Townhall,right
Obama Administration Falls Well Short of Obamacare Sign-Up Goal,Townhall,right
Rep. Franks's Epic Takedown of Those Obsessive Collusion Claims,Townhall,right
Constitutional Scholars: Sustained Airstrikes in Iraq May Be Unconstitutional,Townhall,right
War Veterans: We Miss Dubya,Townhall,right
Impeachment Over Obamacare?,Townhall,right
Mexican Government Calls Out AP Over Fake News (Trump Never Threatened to Invade Mexico),Townhall,right
Wednesday Night Grand Slam ,Townhall,right
Liberal Senator: Nothing in Our Gun Control Bill Would Have Prevented Newtown,Townhall,right
Kevin McCarthy: Pelosi Delayed Coronavirus Funding Bill So Dems Could Run Anti-GOP Ads,Townhall,right
Zero Islamic Terror Attacks: What London and America Need to Learn from Japan,Townhall,right
Texas Will Not Be Setting Up ObamaCare Exchanges,Townhall,right
Confirmed Again: IRS Targeting of Conservatives Came From the Top in Washington,Townhall,right
The Orlando Horror and Hard Truths,Townhall,right
Are Democrats 'Ditching' The War On Women?,Townhall,right
Stagnation: CBO Revises 2014 GDP Growth Projection Down to 1.5 Percent,Townhall,right
Party of the Working Man? Pelosi Proposes Something That Will Give Millionaires Billions in Benefits,Townhall,right
"CIA Using ""Unprecedented"" Polygraphing, ""Pure Intimidation"" to Guard Benghazi Secrets",Townhall,right
Obama Won’t Send Any More Captured Terrorists To Gitmo,Townhall,right
"Americans Think Obamacare Will Increase the Deficit, Not Decrease It",Townhall,right
"BREAKING: Hostage Crisis Unfolding at Chocolate Cafe in Sydney, Australia",Townhall,right
