title,source,bias
New York Times Feels Need to 'Explain' Why They Ran Tom Cotton's Op-ed,Townhall,right
Texas Governor Upends 'Fake News' About Medical Resources in Dallas,Townhall,right
CBS Reportedly Caught Creating Fake News at Michigan Coronavirus Testing Site,Townhall,right
"Under Trump Administration, EPA Workers Are Coming Back To Work In Tears",Townhall,right
"Poll: Hillary 37, Trump 35, Romney 22",Townhall,right
Jeb Bush Makes A Grand Supply Side Entrance,Townhall,right
Trump Announces a Deal to Reopen the Government,Townhall,right
"CNN: Say, Did the White House Mislead Us on the Costs of Obamacare?",Townhall,right
"Theresa May On Defeating Terrorism: ""Yes, That Means Taking Military Action""",Townhall,right
"Paul Ryan's Speech: Too Much Debt, Not Enough Growth",Townhall,right
Post Midterm Democrat Civil War Part 3: Schumer vs. Obamacare,Townhall,right
Freakout: The Media's Breathtaking Double Standards on Patriotism and 'Civility',Townhall,right
"Hmmm: Final Indicators From Early Voting Look...Pretty Good for Republicans, Actually",Townhall,right
DACA Renewal Applications Resume After Judge's Ruling,Townhall,right
'Bait and Switch' Taxes,Townhall,right
"Game Over, Democrats: McConnell was the Grim Reaper to Pelosi’s Wuhan Pork Bill",Townhall,right
OPINION: Five Ways President Trump Is Literally Saving The World,Townhall,right
"McConnell: Due to Endless Democratic Obstruction, It's Time to Fast-Track Trump Nominees",Townhall,right
Illegal Alien Charged With Four Counts of First-Degree Murder Wasn't Deported Thanks to Obama's DACA,Townhall,right
BREAKING: President Trump Will Fully Pardon Dinesh D'Souza,Townhall,right
"Obama Offers One Year Healthcare ""Fix,"" Says Buying Health Insurance Online is ""Complicated""",Townhall,right
OPINION: Why Do Liberals Keep Hurting Themselves?,Townhall,right
Prominent Democrat Publicly Harasses Ken Cuccinelli in 'Shocking' Confrontation at DC Pub,Townhall,right
"The Liberal Media And The Terrible, Horrible, No Good, Very Bad Week",Townhall,right
Trump Rips NYT Over This 'Phony' Story,Townhall,right
Terrific: Former ACORN Workers Are Back as Obamacare 'Navigators' ,Townhall,right
ICE Union President: Gang of 8 Has Contempt For Law Enforcement,Townhall,right
Newt: Trump Race-Baiting Hispanic Judge 'Unacceptable' and 'Inexcusable',Townhall,right
Here’s What FBI Director James Comey Admits In His New Book—And Why Some Liberals Are Infuriated By It,Townhall,right
CNN Lost Their Mind (Again): Guess How Long Their Climate Change Town Hall Is,Townhall,right
"The Nays Have it Ã¢â‚¬Â¦ Oh, Never Mind ",Townhall,right
"As Millions March, German Newspaper Firebombed After Publishing Mohammad Cartoons",Townhall,right
Alexandria Ocasio-Cortez On Pelosi Speakership: She Can Count On Me,Townhall,right
Report: Cheapest Obamacare Plans' Costs Are 'Soaring',Townhall,right
Preview: List of DNC Speakers Looking Pretty Awful,Townhall,right
Hard Reality: No Mainstream Gun Control Law Would Have Stopped the Texas High School Horror,Townhall,right
France: Islamist Shooter In Foiled Train Attack Has Been Identified,Townhall,right
Flake to Introduce Legislation That Would Nullify Trump's Tariffs,Townhall,right
"Minnesota Mulls Obamacare Deadline Postponement: ""Zero Policy Cards Have Been Issued""",Townhall,right
Obama's Iran Deal Probably Won't Be In Writing,Townhall,right
"Grassroots Activists Take Home Major Second Amendment Victory in Colorado, Recall Two Anti-Gun Senators",Townhall,right
OPINION: Analysis: The GOP's Apparent Loss in PA-18's Special Election is an Unspinnable Warning Sign,Townhall,right
The MSM's Hyper-Racial RNC Coverage,Townhall,right
"Ayaan Hirsi Ali on Charlie Hebdo Attack: We Are Seeing an Islamist, Evil Terrorist Ideology",Townhall,right
Bernie's Final Message Before Iowa Caucuses,Townhall,right
"Q-poll: Hillary Slumping in Colorado, Iowa, and Virginia",Townhall,right
"White House Compares Venezuelan President to Assad, Kim Jong Un",Townhall,right
It’s Time to Endanger the Endangered Species Act,Townhall,right
Kavanaugh's Accuser Named Four Other Attendees at the Alleged Party. All Four Have Now Contradicted Her Story.,Townhall,right
"Hey, Dianne, If Your Secret Letter That Could Clip Kavanaugh Was Serious, Why Did You Wait So Long To Contact The FBI?",Townhall,right
The Silent Majority Can Be Silent No More,Townhall,right
"Hillary Clinton Wants 65,000 Middle East Refugees ""Immediately"" But Has No Way To Vet For Terrorism ",Townhall,right
Trump Blocks Pay Raise for Federal Employees,Townhall,right
OPINION: What Ebola Has Revealed About Us,Townhall,right
"Reminder: The Fiscal Cliff ""Solution"" Sets Up Yet Another Ugly Fight ",Townhall,right
Washington State Governor: I am Suspending the Death Penalty,Townhall,right
Can the GOP Establishment Stop Being Idiots Just Once?,Townhall,right
Game Over? Senate Moderates Starting to Line Up Behind Kavanaugh,Townhall,right
How Police Officers Do Their Jobs,Townhall,right
OPINION: Studies Majors: Higher Education?s New Special Ed,Townhall,right
The Math: It's Almost Certain That Rick Scott and Ron DeSantis Have Won in Florida,Townhall,right
Hannity Blows Up At Cruz Over Delegates: 'I'm Getting Sick of It',Townhall,right
Fail: A Majority of Americans Can't Pass This Basic US Citizenship Test. Can You?,Townhall,right
Romney Raises a Quick $4.2 Million After Obama Tax Ruling,Townhall,right
Juneteenth and Modern-Day Slavery,Townhall,right
Nikki Haley Walks Out of UN As Palestinian Envoy Starts Speaking,Townhall,right
Amnesty Isn't Free,Townhall,right
The Free Market Will Destroy the Abortion Industry,Townhall,right
"NBCÃ¢â‚¬â„¢s David Gregory Breaks Gun Laws ""For the Greater Good""",Townhall,right
Will the Arms Trade Treaty Suppress Second Amendment Rights?,Townhall,right
"Carney: Obamacare Implementation Critics ""Willfully Ignorant""",Townhall,right
63 Percent Chance Weather Predictors Are Skeptics on Global Warming,Townhall,right
"Bill Gates Plays Internet Secret Santa, Gives Charitable Gift",Townhall,right
"The Left Eats Their Own: John Kerry Attacked for Comparing Trump to a ""Teenage Girl""",Townhall,right
"Trump on Puerto Rico Recovery: FEMA, Military Can't Stay Forever",Townhall,right
10 Gun Myths Debunked,Townhall,right
Panic: Democrats Fear Another Obamacare Backlash,Townhall,right
Angela Merkel and German 'Freedom' of Speech,Townhall,right
The Media Suppresses Anyone Who Thinks Like You,Townhall,right
All Four Living Presidents Open Up About Their Feelings on Trump's Border Wall,Townhall,right
Cruel Reality of Amnesty Continues: Illegal Aliens Given Priority Over Legal Immigrants Already in Line,Townhall,right
Sanctuary Cities 'Violates Common Sense',Townhall,right
Another Republican Congressman Has Announced Their Retirement Ahead of 2020,Townhall,right
"Jindal, Walker: Obamacare is “Unworkable,” a “Ticking Bomb”",Townhall,right
Economists Agree: Extending Tax Cuts Aids Economy ,Townhall,right
Millennials Aren't As Liberal Once They Start Making Money,Townhall,right
Trump Announces a Freeze on World Health Organization Funding,Townhall,right
"'Suppression,' Debunked: Study Concludes Voter ID Laws Do Not Depress Voter Turnout",Townhall,right
OPINION: Hidden Agenda or Ignorance?,Townhall,right
Video: Obama Treasury Secretary Dodges Questions on IRS Targeting Scandal,Townhall,right
EXTORTION: Nancy Pelosi Threatens to Withhold Impeachment Articles from Senate Republicans,Townhall,right
Trump Take To Social Media To Hit Back At 'Short and Fat' Kim Jong-un,Townhall,right
Uh Oh: An Official NFL Sponsor Considers Nixing Business Partnership Due To Dismal Ratings,Townhall,right
Democrat Who Said IRS Scandal Was Solved Backtracks: It's Not Solved,Townhall,right
"The Pressure is On: Obamacare Site to Go Down Every Night for Repairs, New Privacy Concerns",Townhall,right
Holder: I Don't Really Know How Many Times We've Secretly Monitored Reporters,Townhall,right
The Glorious Alternative Reality of Leftism,Townhall,right
Anti-Gun Activists Trying To Emulate Success Of Marriage Equality Movement,Townhall,right
OPINION: Lessons Learned in Mass Refugee Immigration,Townhall,right
"Katie Couric to Presidential Candidate Carly Fiorina: C'Mon, Aren't You Just Running For a VP Slot? ",Townhall,right
Clinton Gets More Delegates Than Sanders Despite NH Blowout,Townhall,right
Rand Paul's 2016 Decision Could Be A Messy One...Legally,Townhall,right
OPINION: Culture and Social Pathology,Townhall,right
Deadly Protests in Gaza Ahead of Jerusalem Embassy Opening,Townhall,right
Suspected Terrorists From Africa Entering Canada...Through the U.S. After Living Illegally For Years,Townhall,right
"Disgusting: Kim Foxx Defenders Smear Chicago Cops as 'Blue Klux Klan,' Racists",Townhall,right
How Cultural Revolutions Die - or Not,Townhall,right
"NY Gun Rights Activists: Gov. Cuomo is ""Not God""",Townhall,right
Trump Writes Kim Jong Un Epic Letter Cancelling Upcoming Summit,Townhall,right
WaPo Opinion Piece Calls For Elites to Have a 'Bigger Say in Choosing President',Townhall,right
'TODAY' Show Anchor Asks Speaker Ryan if He's Living in 'Fantasy World',Townhall,right
Deal Reached On TPP: Reid Calls It ‘Something That’s Fair’,Townhall,right
Jeff Flake States the Obvious: 'I Couldn't Be Re-elected in My Party Right Now',Townhall,right
Piers Morgan's Latest Idea: Ban Gun Sales and Ownership For People Under 25,Townhall,right
The Racism Liberals Don't Recognize -- Their Own,Townhall,right
OPINION: Is Free Trade Causing Job Loss?,Townhall,right
"During First Mosque Visit, Obama Explains How ?Islam Has Always Been Part of America? ",Townhall,right
Analysis: New Report on Don Jr. and Wikileaks is an Underwhelming 'Bombshell',Townhall,right
Ducks May Be Done at A&E,Townhall,right
Rubio's All In,Townhall,right
How California's AG Responded to Officials Who Are Fighting State's Sanctuary Laws,Townhall,right
Gingrich Explains What the Media's Not Telling You About Trump's Approval Rating,Townhall,right
"No, Accurately Fact-Checking Cruz on Immigration Isn't a 'Smear'",Townhall,right
Experts: Healthcare.gov's 'Fundamental' Data Security Weaknesses 'Alarming',Townhall,right
Welcome to Gunsite Academy: Revealing the Truth About the AR-15,Townhall,right
"With Brexit, A Lot Seems To Be Grounded In Immigration",Townhall,right
Confirmed: FBI Launches New Investigation of Clinton Foundation,Townhall,right
Pruitt Latest Administration Official to Be Confronted by Leftist While Dining Out,Townhall,right
Debt Ceiling to Hit Mid-October,Townhall,right
"MSNBC Host Takes Classless Swipe At Trump, First Lady Melania For The Dumbest Reason Imaginable",Townhall,right
OPINION: Liberalism Is A Social (Media) Disease,Townhall,right
"Womp Womp: ""One-Fifth"" of Dems in Massachusettts Are Undecided",Townhall,right
"Hillary: I Inspired President Obama's Executive Action on Gun Control, You Know ",Townhall,right
Stacey Abrams SOTU Response Was Bizarre (And It's Based on Lies),Townhall,right
OPINION: Fake News and Fake Innocence,Townhall,right
"Hillary, Faux Uniter: Can't We All Just Work Together As Americans?",Townhall,right
"NYT Fact Check: Actually, the Overwhelming Majority of Americans Got a Tax Cut, Despite Democrats' False Propaganda",Townhall,right
Republicans Have No Obligation To Fix Obamacare,Townhall,right
Spain Has Its First Case of Diphtheria in 28 Years Due to Anti-Vax Parents,Townhall,right
Bloomberg Poll: Obama 53 - Romney 40,Townhall,right
New Benghazi Emails Show WH Coordinated False Talking Points,Townhall,right
"OPINION: Here’s Why The Revelation Of Judge Kavanaugh’s Accuser Was Inevitable, And Why It Still Means Nothing",Townhall,right
Romney Delivers Another Rebuke of Trump...and the Trump Team Responds,Townhall,right
OPINION: What Does Female Empowerment Mean?,Townhall,right
"Super Bowl Champion: ""Our Institutions Are Under Attack - God, Family, Country""",Townhall,right
Can They Get Anything Right? Looks Like That ‘Trump Wanted The USS McCain Obscured’ Story Is Fake News,Townhall,right
Rep. Gaetz Claims He Heard Democratic 'Threats' on the House Floor,Townhall,right
Eric Swalwell Announced His Candidacy Tonight And People's Reactions Are Priceless,Townhall,right
Good News: TSA Fails to Screen Airport Workers With Ties to Terrorism ,Townhall,right
"Bill O'Reilly Rips San Francisco Politicians, Obama Administration, Congress Over Criminal Alien Murder in San Francisco",Townhall,right
"Star Parker - Compromise In Politics? No, Confront",Townhall,right
Yet Another Disappointing Jobs Report - Fed Action May Follow,Townhall,right
The 2017 TIME Person of the Year Is...,Townhall,right
Boehner: “School Choice Can Make Anything Possible”,Townhall,right
"For the Record: Yes, Hillary Clinton Should Have Been Prosecuted for Willful Gross Negligence",Townhall,right
"Attorney General Jeff Sessions Condemns White Nationalism, Vows Justice Will Prevail",Townhall,right
"Anita Hill Reveals Biden Called Her, But She Didn't Exactly Accept His Apology",Townhall,right
"Jobs Report: Jobs Up, Revisions Up, Labor Force Stagnant",Townhall,right
Americans: We're Going Over the Fiscal Cliff,Townhall,right
We're Working Closely with Governors to Open the Economy,Townhall,right
"Dead on Arrival: 'Repeal Now, Replace Later' Has Already Crashed",Townhall,right
Why Do Liberals Think We Are Morally Obligated To Die To Make Them Happy?,Townhall,right
"Biden on Self Defense, Round Two: ""Fire the Shotgun at the Door""",Townhall,right
OPINION: Charmless Vessel Shouts Acceptance Speech at America,Townhall,right
BREAKING: Trump Approves Declassification of Documents Related to 2016 Election Spying,Townhall,right
California Gets Sued Over Election Law Requiring Presidential Candidates on Primary Ballot to Release Tax Returns,Townhall,right
Senate Report: Obama Officials Made Congress This Iran Deal Promise...Then Broke it,Townhall,right
"ABC, NBC, And CBS Pretty Much Bury IT Scandal Engulfing Debbie Wasserman Schultz's Office",Townhall,right
America's Largest Health Insurance Company: Obamacare Has Been a Bad Decision For Us ,Townhall,right
"So, I Guess We Have to Talk About Trump's Stupid Twitter War With Mika Brzezinski, Huh?",Townhall,right
"Until Criticized, State Department Refused to Acknowledge Christians Were Target in Easter Suicide Bombing",Townhall,right
"Donald Trump’s alleged porn star affair and hush money scandal, explained",Vox,left
Neither Bush nor Rubio is placing above 4th in Iowa or New Hampshire,Vox,left
These satellite photos show Russia committing an act of overt war against Ukraine,Vox,left
Federal judge strikes down Wisconsin's same-sex marriage ban,Vox,left
Why Joe Biden can't get no respect,Vox,left
Trump whistleblower will testify before the House Intelligence Committee “very soon”,Vox,left
Trump says he’ll reopen the economy “based on a lot of facts and a lot of instincts”,Vox,left
Is America’s future capitalist or socialist?,Vox,left
Amusing ourselves to Trump,Vox,left
Twitter is finally addressing fake accounts. Trump wants it to go after two specific real ones.,Vox,left
"Trump's economic team has a lot of billionaires, very few economic experts",Vox,left
Why America loves — and hates — outspoken young women,Vox,left
Trump chooses Putin's word over the US intelligence community — again,Vox,left
Not all the recent fires at black churches were arson. Here's what we know.,Vox,left
Undocumented immigrants pay taxes too. Here's how they do it.,Vox,left
Why California's drought hasn't sent food prices soaring,Vox,left
NBC's Megyn Kelly's interview with Alex Jones is shaping up to be a disaster,Vox,left
Putin wants Trump to lift sanctions on Russia. Here's how that could actually happen.,Vox,left
Andrew Yang told Asian Americans to prove their Americanness. Here’s why that’s wrong.,Vox,left
"Reince Priebus’s ouster as chief of staff, explained",Vox,left
Turning back Syrian refugees isn't just wrong — it helps ISIS,Vox,left
Donald Trump doesn’t want to make America great. He wants to make it afraid.,Vox,left
The government knows LGBT immigrants are often raped in detention. It puts them there anyway.,Vox,left
We shouldn't talk about Ferguson without talking about guns,Vox,left
The uninsured rate had been steadily declining for a decade. But now it’s rising again.,Vox,left
Why Susan Collins claims she’s being bribed over her Kavanaugh vote,Vox,left
A heroic Playboy reporter defended CNN’s honor at the White House press briefing,Vox,left
The Supreme Court might have just turned a symbolic Trump victory into a real one,Vox,left
"Who’s actually to blame for the looming government shutdown, explained",Vox,left
"One is not born, but rather becomes, a citizen",Vox,left
Obama keeps trying to explain immigration reform instead of actually doing it,Vox,left
4 winners and 2 losers from the 2018 midterm elections,Vox,left
In defense of the New York Times’s anonymous Trump official,Vox,left
Hillary Clinton just gave one of the most important speeches of her career,Vox,left
 Today’s executive orders are the nail in the coffin of Trump’s economic populism,Vox,left
Senate GOP expected to add new penalties for the uninsured into their health bill,Vox,left
It’s time to talk about James Mattis’s involvement with the Theranos scandal,Vox,left
The border is in crisis. Here’s how it got this bad.,Vox,left
Why a pro-same-sex-marriage law professor supports Indiana's religious freedom law,Vox,left
Trump’s big mistake on health care was not realizing Republicans were lying,Vox,left
Evidence suggests 2015 will be a record year for gun sales,Vox,left
Mike Pompeo reportedly met with North Korean leader Kim Jong Un,Vox,left
Where the gun control debate stands in Congress,Vox,left
People have donated millions to fight the Amazon fires. Will the money help?,Vox,left
How teachers unions can survive,Vox,left
"This week’s wild Trump White House chaos, explained",Vox,left
"After one year of Trump, Obamacare is actually doing fine",Vox,left
The Pete Buttigieg boom,Vox,left
"Joe Biden’s low-key campaigning schedule, explained",Vox,left
Trump administration to release hundreds of immigrant families from detention,Vox,left
Twitter has finally started fact-checking Trump,Vox,left
The abandoned asylum seekers on the US-Mexico border,Vox,left
What to expect from this week’s impeachment hearings,Vox,left
"I'm a black ex-cop, and this is the real truth about race and policing",Vox,left
"Rinat Akhmetshin, the potential Russian spy who met Donald Trump Jr., explained",Vox,left
How much of the world's cropland is actually used to grow food?,Vox,left
What Jeb Bush and Hillary Clinton told us with their responses to Baltimore,Vox,left
Obama: we need to eliminate the routine use of the filibuster,Vox,left
NPR’s sanitizing of Trump’s Milwaukee rally shows how he’s broken the media,Vox,left
"To stop gentrification from hurting the poor, neighborhoods need to change faster",Vox,left
Cuba has a possible lung cancer vaccine that America can now test,Vox,left
"Trump’s long, ugly history of championing birtherism, explained",Vox,left
The Supreme Court just let Trump close the Mexican border to nearly all migrants,Vox,left
Hillary Clinton isn’t running unopposed. She’s just crushing the competition.,Vox,left
5 trans Catholics on the Vatican’s rejection of their gender identity,Vox,left
Trump really doesn’t want to talk about his health care record,Vox,left
Read Christine Blasey Ford’s written testimony: “I am here today not because I want to be. I am terrified.”,Vox,left
Why James Comey isn’t the hero you think he is,Vox,left
Intellectual humility: the importance of knowing you might be wrong,Vox,left
New Senate Intelligence report shows “extensive” Russia 2016 election interference,Vox,left
Why Hillary Clinton can get away with not talking about Ferguson,Vox,left
Israel stole classified US information and used it to help congressional Republicans,Vox,left
Don’t overinterpret Tuesday’s election,Vox,left
"The hacked emails at the center of Mueller’s Russia investigation, explained",Vox,left
"Donald Trump’s long history of racism, from the 1970s to 2018",Vox,left
"Once and for all: Obama didn’t crush US coal, and Trump can’t save it",Vox,left
Hillary's general election mobilization challenge is much broader than Bernie voters,Vox,left
John Kelly has become a field commander in Trump’s culture war,Vox,left
The new Republican health care bill doesn't fix the old bill's problems,Vox,left
What America’s new arms deal with Saudi Arabia says about the Trump administration,Vox,left
"Trump and conservative media have their own, quite different version of the Russia scandal",Vox,left
Canada legalizes physician-assisted suicide,Vox,left
Jeb Bush's problem isn't an inability to escape his name. It's that he's not willing to try.,Vox,left
North Korea is the ultimate test of Trump’s dealmaking,Vox,left
How to make sure everyone can vote during the coronavirus pandemic,Vox,left
Ray Rice's arbitration win proves the NFL never took domestic violence seriously,Vox,left
Rand Paul just gave one of the most important foreign policy speeches in decades,Vox,left
Mitch McConnell’s politics of shamelessness have won,Vox,left
We’re about to see states’ rights used defensively against Trump,Vox,left
"Rand Paul wants the government to do much, much less for the poor",Vox,left
Longtime Trump ally Tom Barrack has been interviewed by Robert Mueller’s team,Vox,left
"Bush ethics lawyer: Trump's Russia scandal so far is ""much worse"" than the early stages of Watergate",Vox,left
North Korea says it’s going to blow up its nuclear test site ahead of the Trump-Kim summit,Vox,left
Oil prices could fall further if Iran nuclear deal is reached,Vox,left
The best explanation for Hillary Clinton's bizarre comments about the Reagans and HIV/AIDS,Vox,left
"Jeff Sessions: I didn’t talk with Russians about the Trump campaign. New report: Yes, he did.",Vox,left
Why conservatives are winning the internet,Vox,left
Trump vetoes Congress’s directive to end US involvement in bloody Saudi-led war in Yemen,Vox,left
Trump’s son and top advisers met with a Russian lawyer to try and get dirt on Hillary Clinton,Vox,left
This is how the American system of government will die,Vox,left
Obama's Iran deal is now near certain to survive Congress,Vox,left
Betsy DeVos just rolled back protections for sexual assault survivors. Here’s what that means.,Vox,left
He’s baaack: George W. Bush returns to politics hoping to save GOP Senate majority,Vox,left
The case for impeaching Trump — and fast,Vox,left
Did Trump violate campaign finance law? I asked 11 legal experts.,Vox,left
What Trump’s horrific polling actually tells us — and what it doesn’t — about 2020,Vox,left
North Korea is reportedly making more nuclear weapon fuel,Vox,left
GOP senators are rushing to pass Graham-Cassidy. We asked 9 to explain what it does.,Vox,left
The quiet global crisis that scares the State Department,Vox,left
Why Hillary Clinton is upside down,Vox,left
We asked 8 Senate Republicans to explain what their health bill is trying to do,Vox,left
"Waffle House shooting near Nashville, TN: what we know",Vox,left
Why Bill Gates is worried,Vox,left
"Maine’s governor unleashed an expletive-laden, homophobic tirade on a state representative",Vox,left
Sen. Murphy thinks he can build an on-ramp to single-payer health care,Vox,left
A semi-radical plan to elect more moderates to Congress,Vox,left
Has anyone told Donald Trump that he runs the government?,Vox,left
"Yes, Bernie Sanders’s plan moves America closer to single-payer",Vox,left
"Wages are stagnating, robots are taking our jobs. This Democrat has a $1.4 trillion solution.",Vox,left
The bizarrely mundane reasons why North Korea has stopped testing missiles,Vox,left
How the media should respond to Trump’s lies,Vox,left
Getting unemployment has been a nightmare for millions of people across the country,Vox,left
"Al Franken's selfish, damaging resignation speech",Vox,left
Why ending DACA is so unprecedented,Vox,left
"The gender gap in American newspapers, in 2 charts",Vox,left
"Why Nevada was a bad sign for Bernie Sanders's ""political revolution""",Vox,left
3 reasons the economy boomed in 2015,Vox,left
"President Trump’s wild charge that Susan Rice committed a crime, explained",Vox,left
"The next recession could be around the corner, and the Fed isn't ready for it",Vox,left
Why is North Korea executing high-level officials with anti-aircraft guns?,Vox,left
Trump threatens to send the US military to quash protests,Vox,left
Trump’s plan to limit the pandemic’s death toll: Undercount the numbers,Vox,left
The best evidence yet that Republicans won't do anything on immigration in 2015,Vox,left
The simple reason the Senate Republican health care bill died,Vox,left
"America's gun problem, explained",Vox,left
Rick Perry actually tried to argue that fossil fuels can help fight sexual assault,Vox,left
"Vox Sentences: North Korea announces a ""semi-war state"" with South Korea. Don't freak out.",Vox,left
Mitt Romney’s statement on the Charlottesville anniversary strikes a chord Trump cannot,Vox,left
What Trump didn’t do in 2017,Vox,left
The Senate is about to vote on the future of NSA spying. Here's what you need to know.,Vox,left
So much for states’ rights: Trump asks the Supreme Court to block California’s “sanctuary state” law,Vox,left
"Americans believe their health system is the world's best, but they’re measuring it wrong",Vox,left
Trump is considering a new “travel ban” aimed at the migrant caravan,Vox,left
Scott Pruitt is dismantling EPA in secret for the same reason the GOP health care bill was secret,Vox,left
Part of President Trump’s 2005 tax return was just revealed on The Rachel Maddow Show,Vox,left
"3 dead in Colorado Springs Planned Parenthood shooting, gunman in custody",Vox,left
"The battle over Trump’s tax returns, explained",Vox,left
