title,source,bias
"US employers added 250,000 jobs in October, soaring past expectations",Fox News,right
Bernanke could signal Fed's next step in Hill testimony,Fox News,right
"Malala Yousafzai, Kailash Satyarthi win Nobel Peace Prize",Fox News,right
Shutdown extension ahead?,Fox News,right
"With ban on semi-automatic weapons out, Congress now spars over universal background checks",Fox News,right
Obama Inc. Is Proud to Announce an Expansion  ,Fox News,right
"Veterans, families, sue six banks claiming they helped Iran fund terror groups",Fox News,right
"LA residents fed up with officials, demand change after homeless crisis spirals in city",Fox News,right
"Holder faces tough House questioning, after defending AP records probe",Fox News,right
"Internal FEMA document projects spike in daily coronavirus death toll, but data questioned",Fox News,right
"FCC official, others warn agency study could stifle freedom of the press",Fox News,right
California lawmakers move to shield illegal immigrants from deportation,Fox News,right
"Heat on Stormy Daniels' lawyer over past business dealings, bank record disclosure",Fox News,right
Clinton more than doubles her money edge over Trump in final days of race,Fox News,right
"Roy Moore goes on offense against McConnell, as state party backs bid",Fox News,right
Who is this masked man? FBI seeks public's help to ID jihadist in ISIS video,Fox News,right
The other North Korea threat -- that almost never gets talked about,Fox News,right
"FBI's Strzok and Page spoke of 'secret society' after Trump election, lawmakers say",Fox News,right
'Oprah 2020': NBC and celebs dub Oprah Winfrey 'our future president' after Golden Globes,Fox News,right
Christie sworn in for second term as NJ gov amid controversies,Fox News,right
Hell freezes over: Media start admitting that Trump's first year isn't a flop,Fox News,right
Trump eyes 'four or five' people who may be behind anonymous NYT article,Fox News,right
"Trump ordered to pay $2M in Trump Foundation settlement, admits misuse of funds",Fox News,right
Conservatives flock to CPAC to chart agenda under Trump,Fox News,right
"Dems hang tough in safe GOP districts during special elections, but victories are elusive",Fox News,right
"Fact-check: “Stand your ground” laws don’t increase murder, manslaughter rate",Fox News,right
"Michigan police say 6 dead in random shooting spree, suspect arrested",Fox News,right
"Trump signs trade deal with Mexico, Canada as pact faces Democratic opposition in Congress",Fox News,right
"NRA to 'push back' soon, sources say ",Fox News,right
House Republicans sign on to measure to stop presidential overreach,Fox News,right
"GOP blocks witnesses in Senate impeachment trial, as final vote could drag to next week",Fox News,right
McCain in toughest Senate fight of his life,Fox News,right
The disciplined Donald: How Trump triumphed by toning things down,Fox News,right
What would trigger US strike in Syria? Mixed messages from DOD,Fox News,right
Watchdog: Feds wrongly granted citizenship to hundreds facing deportation,Fox News,right
Republicans to keep focus on ObamaCare repeal if law upheld by court,Fox News,right
"Romney accuses president of 'weakness' abroad, as Obama calls rival 'all over the map'",Fox News,right
OPINION: What the jobs numbers really mean,Fox News,right
"Democrats and Republicans think US closer to arming Syrian rebels, after Israeli strikes",Fox News,right
"Michigan leaders defend Detroit bankruptcy filing, put blame for woes on city",Fox News,right
Editor fired for anti-Obama headline says bosses responded to pressure,Fox News,right
Obama's mystery fee for Italy speech renews debate over lucrative lecturing by ex-presidents,Fox News,right
"Comey calls Clinton email use ‘definition of carelessness’ at Hill hearing, defends FBI",Fox News,right
Obama agenda status report: Did he meet State of the Union goals?,Fox News,right
"Fox News Poll: Voters split on abortion, but majority wants Roe v. Wade to endure",Fox News,right
"First Election Day votes cast as Romney takes campaign into Tuesday, Obama asks for time to 'finish what we started'",Fox News,right
Trump tackles the NFL and national anthem: A timeline,Fox News,right
 IRS turns over to Congress video of employees line dancing,Fox News,right
A truly awful idea: Some liberals would pull plug on Trump’s briefings,Fox News,right
"McCain says Libya strike a 'terrorist' attack, joins others in challenging protest claim ",Fox News,right
"Shutdown enters record 4th week -- with Trump, Dems still split, federal workers unpaid",Fox News,right
Republicans push for House vote to force DOJ to release documents on Trump investigation,Fox News,right
Hong Kong demonstrators storm government building amid protests on anniversary of return of Chinese rule,Fox News,right
NJ Students' Pledge Pits Parents Against School,Fox News,right
Rescue crews frantically searching for 150 believed trapped after deadly overpass collapse in India,Fox News,right
Trump fires back over nixed Eagles visit: ‘No escaping to Locker Rooms!’,Fox News,right
"Dems stop spending to oust Rubio in Florida, as path to Senate takeover gets rockier",Fox News,right
Investigate the investigators? GOP lawmakers urge probe of IRS scandal review,Fox News,right
The Gang That Couldn’t Lie Straight ,National Review,right
The DOJ Will Not Prosecute James Comey over Trump Memos,National Review,right
OPINION: The Trump Rationale,National Review,right
McCain’s Funeral Guest List Doesn’t Define Him,National Review,right
"Kennedy, Clinton, and Weinstein: A Convenient Reckoning   ",National Review,right
"Democrats Lurch Left on Abortion, Immigration, and Health Care in First Debate",National Review,right
Of Presidents and Economies ,National Review,right
"While You Weren’t Looking, the Democrat–Media Election-Hacking Narrative Just Collapsed   ",National Review,right
"Yes, There Was FBI Bias",National Review,right
Fed Study: Trade War Is Harming American Manufacturing,National Review,right
"Trump’s Order on Refugees: Mostly Right on Substance, Wrong on Rollout ",National Review,right
"By Lending More Broadly, the Fed Can Avoid Picking Winners and Losers",National Review,right
The Red-Flag Warning on Your Social Security Statement,National Review,right
"Iran Denies Shooting Down Ukraine Flight, Calls for Boeing to Investigate",National Review,right
Look Who Now Refuses to ‘Accept the Result of This Election’,National Review,right
A Democrat’s Self-Dramatizing Departure Could Bring Real Reform to the FEC ,National Review,right
Do Poor States Need (More) Federal Welfare? ,National Review,right
Kamala Harris Draws Parallels between ICE and the KKK,National Review,right
Al Jazeera America’s Debut ,National Review,right
The New York Times Does Its Best Super-PAC Impersonation  ,National Review,right
New Insurance Numbers Show the Importance of the Trump Administration’s Health-Care Reforms,National Review,right
On the Dangers of Democracy,National Review,right
A Second Fusion GPS Dossier Implicated Clinton Foundation Donors ,National Review,right
Bill Barr Derangement Syndrome,National Review,right
Weighing the Allegations against Brett Kavanaugh,National Review,right
Inequality and the Intellectual Dark Web,National Review,right
"Thin the Herd Further, DNC",National Review,right
"Different Races, Same Boat",National Review,right
Criticism of Mueller Isn’t a Threat to the Rule of Law,National Review,right
Evaluating the GOP’s JUSTICE Act,National Review,right
What Exactly Is Trumpism?   Read more at: http://www.nationalreview.com/article/443667/trumpism-tradition-populism-american-greatness-strong-military,National Review,right
Schumer: Forcing Vote on Kennedy‘s Replacement Before the Midterms Would be ‘Absolute Height of Hypocrisy’,National Review,right
"OPINION: Good Riddance, Justice Kennedy",National Review,right
Republicans Should Not Have Delayed the Kavanaugh Vote,National Review,right
Congress Wasn’t Designed to Handle Tax Policy ,National Review,right
The Labyrinth of Illegal Immigration,National Review,right
Israel Has the Right and Obligation to Defend Its Border with Deadly Force,National Review,right
The Great Conservative Rethink Isn’t Going Away  ,National Review,right
The Trump Administration Isn’t ‘Dehumanizing’ Transgender Americans,National Review,right
Bush 41 Led by Example,National Review,right
The Question Is Not Whether Trump Associates Were Monitored,National Review,right
How Silicon Valley Turned Off the Left and Right,National Review,right
"As New Hampshire goes, So Goes the Senate?",National Review,right
Why the Government Should Not Impose Price Controls,National Review,right
Trump’s Impeachment Prospects Have Little to Do with the Law,National Review,right
The Hydroxychloroquine Meltdown,National Review,right
The FBI’s Dubious Probe of Hillary’s Emails ,National Review,right
"Congrats Boris, R.I.P Fiscal Conservatism",National Review,right
Kerry to Israel: A State Cannot Be Both Jewish and Democratic,National Review,right
The Fires Last Time: Lessons from the 1968 Baltimore Riots ,National Review,right
Another Case of Political Violence: Bomb Discovered at George Soros’s Home,National Review,right
"NYT Splits Presidential Endorsement for First Time in History, Backing Klobuchar and Warren",National Review,right
The Next Syria Strike,National Review,right
"Klobuchar and Buttigieg Stand Out in an Otherwise Dull, Plodding Night",National Review,right
"Politics lost, culture won.",National Review,right
Restoring the Marriage Ecosystem,National Review,right
"Trump Scolds Jim Acosta: ‘You Are a Rude, Terrible Person’",National Review,right
Welcome to America’s Cultural Revolution,National Review,right
The Trump Doctrine Is Trumpism Writ Large,National Review,right
"Trump’s Transition: So Far, So Good",National Review,right
Why Top Tech Journalists Are Wrong about TikTok,National Review,right
The Right Should Reject Tucker Carlson’s Victimhood Populism,National Review,right
Why Yates Had to Go ,National Review,right
The Dumbest Filibuster ,National Review,right
Bernie Sanders Reverses Course on Pro-Life Democrats,National Review,right
"House Passes Two Articles of Impeachment against Trump, Setting the Stage for Senate Trial",National Review,right
The Downward Spiral,National Review,right
"Stop Partisan Cheerleading, and More Christmastime Advice",National Review,right
Pence: Kim Could End Up Like Qaddafi If He Doesn’t Make Deal,National Review,right
Why J. K. Rowling Took a Stand,National Review,right
OPINION: Censure Dianne Feinstein,National Review,right
"Manners, Even in the Age of Trump",National Review,right
The Best Explanation for Our Spate of Mass Shootings Is the Least Comforting,National Review,right
The Likeliest Explanation for Trump’s Helsinki Fiasco,National Review,right
How Long Should We Keep Bribing People Not to Work?,National Review,right
The Disgrace of Portland,National Review,right
"Facebook, Twitter, Google Stifle Ads for Gun Safety Locks",National Review,right
How the Media Undermine Their Credibility,National Review,right
Outrageous Redactions to the Russia Report,National Review,right
Let’s Not Throw Out the Constitution  ,National Review,right
"On Ferguson, Elizabeth Warren and Kamala Harris Told a Terrible Lie",National Review,right
Liberal Think Tank Refutes Case against Trump’s Health-Insurance Deregulation,National Review,right
"Health Care, from the Top   Read more at: http://www.nationalreview.com/article/447361/heath-care-reform-no-cure-scarcity",National Review,right
The ‘Institutional Racism’ Canard,National Review,right
Big Government Has Hurt Our Ability to Deal with This Crisis,National Review,right
Are We Finally Turning the Corner on This Thing?,National Review,right
The Church of Grievance,National Review,right
The Supreme Court Should End DACA,National Review,right
"DOJ Declined to Investigate Trump Ukraine Call, Found No Campaign Finance Violation",National Review,right
Biden Joins His Democratic Rivals in Left Field,National Review,right
"Gun Politics, Twitterized",National Review,right
OPINION: Confirm Pompeo,National Review,right
Flynn and the Anatomy of a Political Narrative,National Review,right
How the Trump Campaign Is Preparing for 2020,National Review,right
The Revolution Comforts the Comfortable,National Review,right
"Hey Democrats, ‘Disinformation’ Can Sort Itself Out",National Review,right
The Media Was Wrong About the Caravan,National Review,right
The Possibility of a Biden-Klobuchar Ticket Is Canceled,National Review,right
Overturning DACA Would Be a Win for the Constitution,National Review,right
The Anti-Semitic Mass-Murder Attack in Pittsburgh,National Review,right
How Mueller’s Lawyers Spun the OLC Guidance on Indicting a Sitting President,National Review,right
Can America’s Divides Be Healed?,National Review,right
When the Tide Comes In,National Review,right
The Problem with the Left’s Attempts to Redefine Racism,National Review,right
Rebuilding the GOP after November 9,National Review,right
The Bipartisan Failure of the Individual Mandate   ,National Review,right
Who Was Steve Bannon? ,National Review,right
Why Romney DoesnÃ¢â‚¬â„¢t Need a Poll Lead in Ohio,National Review,right
The Idolatry of Journalism ,National Review,right
The Political Equivalent of War?,National Review,right
‘Free Speech’ Means Just That,National Review,right
NYU Newspaper Pulls Ad for Lowry’s Nationalism Book Out of Concern It Might ‘Marginalize People of Color’,National Review,right
Humana To Pull Out Of Obamacare Exchanges for 2018,National Review,right
"We’re Not in a Civil War, but We Are Drifting Toward Divorce ",National Review,right
Alabama Lawmaker Protests Abortion Restrictions by Introducing Bill Requiring Men to Undergo Vasectomy after Third Child,National Review,right
John Durham’s Investigators ‘Do Not Agree’ with DOJ IG’s Findings on Origin of Russia Probe,National Review,right
OPINION: The ‘March for Our Lives’ Moral Panic,National Review,right
American Security and Islamic Reform,National Review,right
Last Century’s Absurd Immigration Debate,National Review,right
The Coronavirus Pandemic May Leave Lasting Scars on Generation Z,National Review,right
Parkland Students to Announce Nation-Wide Gun-Control Tour,National Review,right
"It’s the Hypocrisy, Stupid",National Review,right
Can Anyone Beat Boris?,National Review,right
"Trump Says Border Troops Could Reach 15,000, Catching Pentagon Off Guard",National Review,right
McCabe and Papadopoulos: Two-Tiered Justice,National Review,right
"France Will Now Choose between Two Outsiders, Macron and Le Pen ",National Review,right
Mark Zuckerberg Is Right,National Review,right
The Anti-Porter Conspiracy,National Review,right
Why So Little Coverage of the ICE Attack?,National Review,right
Bernie’s Margin of Victory in New Hampshire: 1 Point,National Review,right
The Mike Pence E-mail ‘Scandal’ Exposes Only Democrats’ Amnesia about Hillary,National Review,right
"Revoking Brennan’s Security Clearance: The Right Thing, Even if for the Wrong Reason",National Review,right
The 2020 Democrats’ Extremism on Abortion,National Review,right
The Bogus Lawsuit against Remington,National Review,right
Thinking about the Comey Memos ,National Review,right
Obama Wiretapping? Trump Colluding? We Are Headed Down a Rabbit Hole,National Review,right
Just Say ‘Yes’ to Prosperity,National Review,right
Will There Be Consequences for a Democratic Law Firm Caught Funneling Campaign Funds?,National Review,right
History Doesn’t Favor Republicans Recovering the House under Trump,National Review,right
The Killing of Soleimani Was Not an ‘Assassination’,National Review,right
"Yes, Investigate the Investigators  ",National Review,right
NY Times Editor Says Biden Sexual-Assault Article Was Edited after His Campaign Complained,National Review,right
Team USA Bobsledder Receives Barrage of Hate for Photo With Ivanka,National Review,right
"We Need Law and Order, but Not Necessarily Federal Troops",National Review,right
U Penn Removes Shakespeare Portrait Because He Does Not Represent ‘Diversity’,National Review,right
The Ancient Laws of Unintended Consequences   Read more at: http://www.nationalreview.com/article/445548/democrats-unintended-consequences-media-collusion-partisan-overreach,National Review,right
Debunking the ‘Born This Way’ Myth,National Review,right
The Low-Temperature Election,National Review,right
‘I Was Just Hoping to Get a Fair and Equal Treatment’: Tara Reade Calls Out Democrats’ ‘Me Too’ Double Standard,National Review,right
"Senate Republicans Block Schumer’s Attempt to Subpoena White House Witnesses, Docs",National Review,right
Never Trump Nevermore,National Review,right
Republicans’ Grim Health-Care Fairy Tale,National Review,right
WHO Failed,National Review,right
Impeachment Doesn’t Require a Crime,National Review,right
The Schiff Memo Harms Democrats More Than It Helps Them,National Review,right
OPINION: Mexico — What Went Wrong?,National Review,right
China Boomeranging,National Review,right
Is the Conservative Movement for Supreme Court Reform Dead?,National Review,right
‘Common-Good Capitalism’ Can Reinforce Freedom,National Review,right
The Media Urge to Explain away ‘Defund the Police’,National Review,right
Jerry Nadler’s Leaked Rebuttal of the Nunes Memo Is Very Weak   ,National Review,right
Donald Trump Just Struck a Blow against Authoritarianism,National Review,right
College Board Introduces ‘Adversity Score’ to Control for Privilege in Admissions,National Review,right
A Solid Accomplishment on Taxes   ,National Review,right
"As Bipartisan Support for Nuclear Energy Grows in Congress, Progressives Should Reconsider Their Opposition",National Review,right
http://www.nationalreview.com/article/444106/obama-lies-voter-id-many-countries-require-it,National Review,right
A Supreme Successor to Justice Scalia,National Review,right
Don’t Blame Bleachgate,National Review,right
The Political Media Are Failing America,National Review,right
Booker Refuses To Say Whether His Plan Would Result In Jailed Gun Owners,National Review,right
"Thank You, Susan Collins",National Review,right
Trump’s Embarrassing Surrogate Circus,National Review,right
"On Coronavirus, Where Are All the Grownups?",National Review,right
Debates Show How Much Obama’s Presidency Has Shrunk,National Review,right
Birthright Citizenship: A Nutty Policy We’re Probably Stuck With,National Review,right
Conservatism in the People’s Republic of Berkeley,National Review,right
Why Elizabeth Warren’s Attack on Bernie Backfired,National Review,right
"Hillary Clinton, Brett Kavanaugh, and the Art of Trolling",National Review,right
Trump Keeps Giving Mueller Reasons to Pursue the ‘Collusion’ Probe,National Review,right
Is It the Right or the Academy That’s Lost Faith in Free Inquiry?,National Review,right
Iowa’s Democratic Disaster,National Review,right
America’s Response to the Coronavirus Proves Federalism Isn’t Dead,National Review,right
Against John Kelly as White House Chief of Staff,National Review,right
Does America Still Believe in the Right to Be Wrong? ,National Review,right
Reminder: Hillary Clinton Lost Because She’s Hillary Clinton,National Review,right
The Anti-Trump Media’s ‘Missing Kids’ Myth,National Review,right
The Ideological Blindness at the Heart of Media Bias,National Review,right
The Math in Alabama Doesn’t Add Up to a State-Funded Recount,National Review,right
The Myth of the Idle Rich,National Review,right
The New Post-Trump Constitution,National Review,right
Don’t Shred Your Credibility for Your Tribe ,National Review,right
A Dull Debate Night Helps the Front-Runners,National Review,right
Don Lemon Did Trump a Huge Favor,National Review,right
Bernie’s Daft Debt Jubilee,National Review,right
Life Is Winning in America ,National Review,right
Colluders on the Loose,National Review,right
The World Turned Upside-Down,National Review,right
Planned Parenthood’s Century of Brutality ,National Review,right
OPINION: Against the Spending Bill ,National Review,right
Trump Congratulates AG Barr for ‘Taking Charge’ of Roger Stone Case,National Review,right
China Once Looked Tough on Trade. Now Its Options Are Dwindling.,New York Times - News,left
Army Suspends Its Purge of Immigrant Recruits,New York Times - News,left
An Unusual Feat in Congress: Student Loan Bill Breezes On,New York Times - News,left
OPINION: Why Sessions Is Right to Stand Up to Trump,New York Times - News,left
Brett Kavanaugh Urged Graphic Questions in Clinton Inquiry,New York Times - News,left
"In Year Since Searing Death, Ferguson Sees Uneven Recovery",New York Times - News,left
Kerry’s Comments on Syria Are a Shift Over Strike,New York Times - News,left
"Ted Cruz, Seeking Converts to His Campaign, Rallies Iowa Evangelicals",New York Times - News,left
"In Pawlenty, Romney Campaign May Find Down-to-Earth Appeal ",New York Times - News,left
Boehner Cancels Tax Vote in Face of G.O.P. Revolt,New York Times - News,left
"In Secret, Court Vastly Broadens Powers of N.S.A.",New York Times - News,left
White House Offers Stealth Campaign to Support Immigration Bill,New York Times - News,left
"‘No Vacancies’ for Blacks: How Donald Trump Got His Start, and Was First Accused of Bias",New York Times - News,left
"As Trade War Spreads to Mexico, Companies Lose a Safe Harbor",New York Times - News,left
"A Gyrating Economy, and Trump’s Volatile Approach to It, Raise Alarms",New York Times - News,left
Ohio Working Class May Offer Key to ObamaÃ¢â‚¬â„¢s Re-election,New York Times - News,left
The Cost of Trump’s Aid Freeze in the Trenches of Ukraine’s War,New York Times - News,left
Stories of Struggle and Creativity as Sequestration Cuts Hit Home,New York Times - News,left
Romney Exhibits a Change in Tone on Immigration,New York Times - News,left
OPINION: Susan Rice: Trump’s Most Foolish Decision Yet,New York Times - News,left
Trump Administration to Roll Back Clean Water Protections,New York Times - News,left
Conservative Website First Funded Anti-Trump Research by Firm That Later Produced Dossier,New York Times - News,left
"In Senate, Complex Fight Over Curbing Military Sexual Assaults",New York Times - News,left
Ted Cruz Didn’t Report Goldman Sachs Loan in a Senate Race,New York Times - News,left
"From Fracking to Finance, a Torrent of Campaign Cash",New York Times - News,left
The Left Is Still Leery of Biden. Here’s How He’s Reaching Out to Them.,New York Times - News,left
Federal Judge Blocks Part of Trump’s Plan to Build Border Wall,New York Times - News,left
Military Reviews U.S. Response to ISIS Rise,New York Times - News,left
"To Defeat Terror, We Need the World’s Help",New York Times - News,left
"Bipartisan Support, With Caveats, for Obama on Iraq Airstrikes",New York Times - News,left
"Amid Pipeline and Climate Debate, Energy-Efficiency Bill Is Derailed",New York Times - News,left
‘Not for Sale’: Trump’s Talk of Buying Greenland Draws Derision,New York Times - News,left
White House Tries to Soothe British Officials Over Trump Wiretap Claim,New York Times - News,left
Trump Is Making a Huge Mistake on Jerusalem,New York Times - News,left
Schumer and Pelosi Tap Themselves to Respond to Trump Speech,New York Times - News,left
Ruling Striking Down Obamacare Moves Health Debate to Center Stage,New York Times - News,left
Kavanaugh Hearing: Christine Blasey Ford’s Testimony Grips Nation as G.O.P. Shrugs It Off,New York Times - News,left
Stark Backdrop as President Prepares to Debate,New York Times - News,left
"Appointed to Redeem Secret Service, Director Will Discuss Another Misstep",New York Times - News,left
Obama Ready to Authorize Airstrikes on ISIS in Syria,New York Times - News,left
Which Presidential Candidates Are Winning the Money Race,New York Times - News,left
"Obama, in a Shift, to Limit Targets of Drone Strikes",New York Times - News,left
What if Age Is Nothing but a Mind-Set?,New York Times - News,left
How Social Media Silences Debate,New York Times - News,left
Kurdish Forces Retake Strategic Highway in Iraq’s North From ISIS,New York Times - News,left
Donald Trump Is Not Going Anywhere,New York Times - News,left
Syria Strike Puts U.S. Relationship With Russia at Risk,New York Times - News,left
U.S. Directly Blames China?s Military for Cyberattacks,New York Times - News,left
"Obama and Romney Trade Shots, a Few Possibly Accurate, on Outsourcing",New York Times - News,left
Louisiana Agency Sues Dozens of Energy Companies for Damage to Wetlands,New York Times - News,left
Selling Health Care Reform,New York Times - News,left
Egyptian PresidentÃ¢â‚¬â„¢s Hedging on Decree Fails to Stop Protest,New York Times - News,left
"Tillerson, on Eve of Russia Trip, Takes Hard Line on Syria",New York Times - News,left
Trump Moves to Regulate ‘Bump Stock’ Devices,New York Times - News,left
"Mr. President, Tear Down This Wall",New York Times - News,left
Police Identify Woman Who Wounded 3 at YouTube and Killed Herself; Motive Is Unclear,New York Times - News,left
ArizonaÃ¢â‚¬â„¢s Immigration Law and Mandatory Life Terms ,New York Times - News,left
U.S. Jobs Report Highlights Economy’s Strength Despite Market Tumult,New York Times - News,left
"Hillary Clinton vs. Elizabeth Warren Could Be a Dream Match, for Republicans",New York Times - News,left
"Lost in Recession, Toll on Underemployed and Underpaid ",New York Times - News,left
Would ‘Medicare for All’ Save Billions or Cost Billions?,New York Times - News,left
Obama Begins Commemoration of Vietnam Era,New York Times - News,left
G.O.P. Is Making Progress Toward Presidency but Is Still Playing Catch-Up,New York Times - News,left
OPINION: Take a Bad Year. And Make It Better.,New York Times - News,left
