title,source,bias
Young voters usually sit out the midterms. There are signs 2018 could be different.,CNN,left
"On immigration, GOP offers fear, not ideas",CNN,left
May jobs report: Cautious hiring continues,CNN,left
Gun lobby may emerge victorious when smoke clears,CNN,left
Obama administration: Website won't be perfect on November 30,CNN,left
Picking up a bagel instead of a partisan fight,CNN,left
U.S. official sought more security for Benghazi post,CNN,left
"Mitt Romney: Donald Trump is a 'phony, a fraud'",CNN,left
CNN National Poll: Dead heat between Obama and Romney,CNN,left
Election 2016: Rand Paul poised to launch campaign,CNN,left
From Guinea to the U.S.: Timeline of first Ebola patient in New York City,CNN,left
Rand Paul: Hillary’s 'fingerprints' all over talking points,CNN,left
 Winner led from wire-to-wire,CNN,left
Capitol Hill ceremony to honor Bush offers bipartisan moment,CNN,left
Justices poised to tackle constitutional right of same-sex marriage,CNN,left
Spending cuts: What you need to know,CNN,left
ISIS claims responsibility for Texas attack,CNN,left
Immigration’s prospects in House still not clear,CNN,left
Six things to watch at the Republican debate,CNN,left
U.S. extends embassy closures after intercepted al Qaeda message,CNN,left
OPINION: Why keeping us safe from terrorism is so hard,CNN,left
Foundation becomes campaign issue,CNN,left
'I have never seen him eat a vegetable:' Trump braces for a beef-free menu in India,CNN,left
"Why this time? On immigration, McCain points to 'elections'",CNN,left
What hand will al-Maliki play in Iraq?,CNN,left
"Biden welcomes new Americans, slams Boehner on immigration bill",CNN,left
CNN Poll: Big swing for Democrats but not where they need it,CNN,left
Clinton and Sanders accuse Trump of inciting violence,CNN,left
Democrats lose on budget deal,CNN,left
"Washington prepares for budget cuts, culture changes",CNN,left
"28 days to go: After weeks of struggles, a horse race for Mitt Romney",CNN,left
Stocks slip on weak jobs report ,CNN,left
"Could Republican Convention delegates be bought? Legally, maybe",CNN,left
Boehner blasts reported Obama budget as 'wrong direction',CNN,left
Poll: Who will win Wednesday's debate?,CNN,left
Netanyahu's honeymoon with Trump ends abruptly,CNN,left
TRENDING: CPAC attendees prop up Rubio as other potential VPs audition,CNN,left
Heat is on FBI over handling of bombing suspect,CNN,left
Obama administration weighs in on defense of marriage law,CNN,left
Gun control: It's on all of us ,CNN,left
Is it finally morning in Obama's America?,CNN,left
Donald Trump's obsession with himself,CNN,left
Obama: Snowden can 'make his case' in court; no Olympics boycott,CNN,left
Fault lines: GOP civil war deepens,CNN,left
Giuliani says Mueller has agreed to narrow scope of potential Trump interview,CNN,left
Hillary Clinton's gender politics,CNN,left
Pope: 'Revolution' needed to fight climate change,CNN,left
White House: Still committed to assault weapons ban,CNN,left
Supreme Court strikes down part of DOMA,CNN,left
What to watch in Tuesday's primaries,CNN,left
"Forecast for new Congress: Gridlock, partisan warfare",CNN,left
"Pence's press secretary tests positive for coronavirus, Trump says",CNN,left
Five things we learned from Thursday's vice presidential debate,CNN,left
"'Clean' debt-ceiling hike clears House, heads to Senate",CNN,left
Obama stumps in surprise battleground state,CNN,left
"Biden calls on African leaders in fight for democracy, pledges U.S. support",CNN,left
Senate passes package to avert fiscal cliff; House votes next,CNN,left
House says it needs Don McGahn's testimony for Senate trial and because Trump could face more articles of impeachment,CNN,left
"Shinseki apologizes, orders VA fixes ",CNN,left
Trump says he canceled secret Camp David meeting with Taliban leaders,CNN,left
Thai cave rescue operation suspended after four more boys freed,CNN,left
"Court ruling cements Obama's political legacy, experts say",CNN,left
9/11 first responder and advocate Luis Alvarez dies at 53,CNN,left
"OPINION: Conservatives need Facebook, it needs us",CNN,left
OPINION: Why are these candidates losing the GOP race so far?,CNN,left
"New DC routine: Wake up, search WikiLeaks, wince",CNN,left
Hillary Clinton's email scandal is exactly what you can expect from her presidential campaign,CNN,left
How to be rich and believe in equality,CNN,left
5 things we learned in Monday's debate,CNN,left
We need transparency on domestic surveillance,CNN,left
CNN Poll: Did White House order IRS targeting?,CNN,left
6 things to watch on night two of CNN's Democratic presidential debate in Detroit,CNN,left
Bernie Sanders defends unionized staffers' salaries amid clash with campaign over guarantee of $15 an hour,CNN,left
Divers find cabins crammed with bodies inside sunken ferry,CNN,left
"Iran nuclear talks: Anger, gloom in Tehran after deal falls through",CNN,left
Alabama Senate passes near-total abortion ban,CNN,left
Trump signs massive budget deal after Congress votes to reopen government,CNN,left
Petraeus: I did not pass classified info,CNN,left
Trump attacks force Jeb Bush out of his malaise - CNNPolitics.com,CNN,left
Trump finds the limits of executive power,CNN,left
Five scenarios: Health care options before the justices ,CNN,left
"Oscar Pistorius guilty of negligent killing of girlfriend, one gun charge",CNN,left
5 things we learned from Election Night 2013,CNN,left
Obama will name Ron Klain as Ebola Czar,CNN,left
Charlie Hebdo attack: The hunt for the killers,CNN,left
"Obama warns of further steps in Egypt, cancels military exercises",CNN,left
Jared Kushner is quietly tackling Washington's swamp,CNN,left
"Obama, Republicans clash on forced spending cuts",CNN,left
OPINION: Get proactive about screening for Ebola,CNN,left
Road to 270: CNN's latest electoral college map,CNN,left
Elizabeth Warren launches exploratory committee ahead of likely 2020 presidential run,CNN,left
North Korea sentences U.S. student to 15 years hard labor,CNN,left
How China doesn't play fair on trade,CNN,left
Cornyn: Why I can't support Hagel ,CNN,left
Can Donald Trump recover from this?,CNN,left
US imposes sanctions against Russian oligarchs and government officials,CNN,left
House Democratic women's numbers don't yet add up to power,CNN,left
Opinion: Gun debate? What gun debate?,CNN,left
What candidates' wives are telling us,CNN,left
"Obama calls for reducing U.S., Russian nukes",CNN,left
Congressman: Syria strike not worth risk,CNN,left
Justice Dept.: Cleveland police have pattern of excessive force,CNN,left
Apple CEO Tim Cook comes out: 'I'm proud to be gay',CNN,left
UN Ambassador Nikki Haley resigns,CNN,left
Democratic debate: CNN's Reality Check team inspects the claims - CNNPolitics.com,CNN,left
Palin: Are you ready to make America great again?,CNN,left
Trump says US is ending decades-old nuclear arms treaty with Russia,CNN,left
Cruz to CNN: ‘I don’t work for the party bosses in Washington’,CNN,left
Hot piece of land in Hoboken at center of Christie-Zimmer dispute ,CNN,left
House immigration compromise includes tougher path to citizenship than Senate bill,CNN,left
High court puts same-sex marriage on hold in Utah,CNN,left
Candidates buy $40 million more in ads in record-setting campaign,CNN,left
Obama calls deaths in South Carolina church shooting 'senseless murders',CNN,left
Britain moves out of recession ,CNN,left
‘Stop Hillary’ group ramps up anti-Clinton efforts,CNN,left
"With their big political win, the new American electorate has arrived",CNN,left
OPINION: The Confederacy's legacy: Should any of it stand?,CNN,left
How John Roberts will manage the Supreme Court's conservative majority,CNN,left
Senate leaders to try to work out fiscal cliff deal over weekend,CNN,left
"House GOP unveils bill to avoid shutdown, lessen pain for defense programs from forced spending cuts",CNN,left
"Margaret Thatcher, Britain's first female PM, dead at 87",CNN,left
Mitch McConnell's mission to keep the GOP majority,CNN,left
New York highway closed in search for escaped killers,CNN,left
"2 police killings, 2 outcomes: Lessons learned from Ferguson to South Carolina",CNN,left
Trump adds to chaos of health care deliberations,CNN,left
Tumult surrounds Trump days ahead of his presidency,CNN,left
"Pickering defends Benghazi report, says criticisms not based in fact",CNN,left
Finland is winning the war on fake news. What it’s learned may be crucial to Western democracy,CNN,left
Wall Street wasn't ready for another Mitt Romney campaign,CNN,left
The legal battle over Obama's immigration plan,CNN,left
What we can learn about relationships from politically divided couples,CNN,left
"Hagel takes on critics, embraces Obama policies at rocky hearing",CNN,left
No sign of Paris suspect in Belgium raids as Brussels remains under high alert,CNN,left
Obama offers fix for canceled plans,CNN,left
Texas hospital official: 'We are deeply sorry' about Ebola mistakes,CNN,left
"Donald Trump challenged over 9/11, Iraq War comments",CNN,left
China lodges complaint over Trump-Taiwan call,CNN,left
The many challenges of replacing Eric Holder,CNN,left
Deal reached on human trafficking bill paves way for Lynch vote,CNN,left
Looking at the polls & state of the campaign in the homestretch,CNN,left
Disney is buying most of 21st Century Fox for $52.4 billion,CNN,left
"'Absolute disastrous mess': 6 dead, 150 injured after Amtrak train derails",CNN,left
Trump chooses his own version of reality to back Moore,CNN,left
Obama condemns killing of U.S. ambassador to Libya ,CNN,left
These 5 indisputable realities make a government shutdown a very real possibility,CNN,left
Unemployment falls below 6% for first time since 2008,CNN,left
Same-sex marriage rulings complicate path forward for GOP,CNN,left
"OPINION: Hillary Clinton, Barack Obama both wrong",CNN,left
"Ohio passes second bill restricting abortions, both await Gov. Kasich's signature",CNN,left
"Iran's power rises, with or without deal",CNN,left
Benghazi -- government cover-up or right-wing conspiracy theory?,CNN,left
Donald Trump's 'rigged' election claim targets the media,CNN,left
Obama to name John Brennan to lead CIA,CNN,left
Don't rush to join Benghazi blame game,CNN,left
Sessions did not disclose meetings with Russian ambassador,CNN,left
"Inside Politics: When it comes to midterms, 'It's the economy, stupid'",CNN,left
Is the U.S. less safe from terror?,CNN,left
Obama maintains military pressure on Syria,CNN,left
This is a First,CNN,left
The tumultuous 2016 campaign is in a sudden limbo,CNN,left
Cruz hails release of U.S. pastor held in Iran,CNN,left
"For Hurricane Katrina anniversary, Obama cites inequities 'brewing for decades'",CNN,left
"Can Donald Trump really hit 1,237 before Cleveland?",CNN,left
Supreme Court sides with Oregon bakery that refused to make cake for same-sex wedding,CNN,left
Republican debate: Fact-checking the candidates,CNN,left
Who were Syed Rizwan Farook and Tashfeen Malik?,CNN,left
Team Romney blasts Obama campaign for 'desperate tactics',CNN,left
Rand Paul introduces bill to end the type of warrant involved in Breonna Taylor's death,CNN,left
Was Hagel doomed from the start?,CNN,left
Trump's mood takes a foul turn: 'He's pissed -- at damn near everyone',CNN,left
"For 20-somethings, health care hangs in the balance",CNN,left
Sebelius orders review of Obamacare website woes,CNN,left
New poll: Obama has double digit advantage,CNN,left
It's not all over for Romney,CNN,left
Romney seeks advantage from controversial comments,CNN,left
Why politicians lie and why we want to believe them,CNN,left
Palin eyeing energy secretary in potential Trump administration,CNN,left
Barack Obama's emotional evolution on gun control,CNN,left
5 takeaways from the Republican debate in Miami,CNN,left
Collins says IRS revelations will fuel government distrust,CNN,left
"Inside the White House, aides and advisers are despondent over a wasted month",CNN,left
"GOP hopes new class of black Republicans signals trend, data suggests otherwise",CNN,left
Donald Trump unveils plan to slash taxes for the poor -- and the wealthy,CNN,left
Primaries will be a key test of GOP establishment-tea party battle,CNN,left
"Speaking on Islam, will Trump hit reset with Muslims?",CNN,left
Former troops say time has come for women in combat units,CNN,left
Jenny Horne's tearful Confederate flag speech shakes S. Carolina statehouse,CNN,left
Explain Obamacare at last,CNN,left
Obama outspends Romney on online ads,CNN,left
Obama missed chance to seal victory over Romney,CNN,left
Syrian group cited as New York Times outage continues,CNN,left
Laura Bush: Take me out of pro-gay marriage ad,CNN,left
"Scarborough, Brzezinski say White House used National Enquirer as threat",CNN,left
OPINION: What Cuba deal says to Latin America,CNN,left
GOP rips Obamacare enrollment figures,CNN,left
What is Putin's endgame in Ukraine?,CNN,left
Supreme Court to rule Thursday on health care ,CNN,left
The Obamacare question: Can the website handle the volume?,CNN,left
Feds investigate Christie's use of Sandy relief funds,CNN,left
Trump defiant as pressure grows,CNN,left
Liberal 'dark money' groups outspent conservative ones in 2018 elections,Fox News,right
"Michelle Obama touts husband's humble roots, asks for time to see 'change' through",Fox News,right
"Dallas lab worker quarantined aboard cruise ship, other passengers stranded aboard",Fox News,right
"Poll says Trump is divisive, but he's got plenty of company (including the media)",Fox News,right
"Gun Geo Marker app tries to locate homes, businesses of gun owners",Fox News,right
"Trump sets red line for Mueller on Russia probe, warns he'll expose 'conflicts'",Fox News,right
Millennial: On Sept. 11 anniversary let's remember what unites us as Americans,Fox News,right
"Klobuchar, at Fox News town hall, dings Trump on coronavirus, rips cost of Sanders’ proposals",Fox News,right
Slamming the script: Why the press is dismissing the president's do-over,Fox News,right
Pro-democracy protesters in Hong Kong give deadline for demands,Fox News,right
Experimental drug the 'best choice' for American journalist with Ebola,Fox News,right
"Organizers of US-bound immigrant caravan accuse Trump of 'bullying,' 'threats of mass violence'",Fox News,right
Clinton 'does not recall' ordering destruction of emails from personal server in testimony,Fox News,right
"Democrat-led Senate set to finally vote this week on Keystone, in odd turn of political events",Fox News,right
Biden says he won’t be part of witness deal some Democrats reportedly eyeing,Fox News,right
"Obama signs bill ending partial shutdown, raising debt ceiling",Fox News,right
Mexico backs left-wing 'messiah' Andres Manuel Lopez Obrador in historic presidential election,Fox News,right
Republicans aim to call Obama's 'bluff' on spending cuts,Fox News,right
Supreme Court rules human genes cannot be patented  ,Fox News,right
White House's $100M mental health pledge: Token gesture or real effort at reform?,Fox News,right
"Dems silent on Iran protests as demonstrators blame regime, not Trump, for plane crash",Fox News,right
"Warmbier's parents push back on Trump comments, blame Kim’s ‘evil regime’ for son’s death",Fox News,right
Chief Justice Roberts poised for starring role in a Trump impeachment trial,Fox News,right
Planned Parenthood receives record amount of taxpayer support ,Fox News,right
Fast & Furious amnesia hits Attorney General Eric Holder during House testimony ,Fox News,right
"OPINION: RNC Chairman: Tom Steyer, Democratic allies trying to keep GOP voters away from polls",Fox News,right
OPINION: Obama's immigration amnesty: Proof our president has failed,Fox News,right
Obama to announce Supreme Court nominee Wednesday,Fox News,right
"US unemployment claims fall to 326K, 5 1/2-year low ",Fox News,right
Supreme Court rejects Trump bid to enforce asylum crackdown,Fox News,right
Top intel office not on same page as CIA regarding Russia hack assessment,Fox News,right
Hagel orders 21-day quarantine for all military personnel returning from Ebola mission in West Africa,Fox News,right
"OPINION: CIA interrogations report: Feinstein offers aid and comfort to enemy, stabs heroes, allies in the back",Fox News,right
Stocks charge into positive territory after Fed cuts rates,Fox News,right
Schumer welcomes departure of 'toxic' Zinke from Trump's 'swamp cabinet' Adam Shaw,Fox News,right
Day One of public impeachment hearings puts pressure on moderate Dems,Fox News,right
Palestinians accept new 72-hour cease-fire offer,Fox News,right
Fiscal crisis package loaded up with special-interest tax breaks  ,Fox News,right
"Trump signs tax overhaul, budget bill before heading to Mar-a-Lago",Fox News,right
"Obama pushes for tax hike on top earners, extension of Bush-era rates for others ",Fox News,right
ObamaCare faces another challenge in federal court,Fox News,right
Dow is on track for a second straight day of gains,Fox News,right
North Carolina's sweeping voter ID law faces legal challenge,Fox News,right
Judge Napolitano calls Weinstein verdict a 'monumental setback' for government,Fox News,right
"Touring Mississippi civil rights museum, Trump honors those 'who sacrificed so much'",Fox News,right
"London attack: Trump says US must get 'nasty' to fight terror, urges 'tougher' travel ban",Fox News,right
America's female soldiers: Bravely serving and dying in the line of duty,Fox News,right
Boehner says House will take up Senate budget plan,Fox News,right
Romney keeps focus on the economy as heartland bus tour hits Pennsylvania,Fox News,right
"1 percent pay raise latest pinch for troops, veterans struggling to pay bills",Fox News,right
With Obama's budget proposal Tuesday comes Ryan's first big test,Fox News,right
Mark Levin blasts 'absurd' media analysis of impeachment hearings: 'It's disgraceful ... They sound like the Russian media',Fox News,right
Can Obama's Jam and Slam Approach Work on Immigration?,Fox News,right
Will Democrats show up to vote? Polls point to GOP turnout advantage,Fox News,right
"Trump-free debate a good thing for candidates, country",Fox News,right
"Kavanaugh accuser Swetnick faces credibility questions amid changing story, details from past",Fox News,right
Tea Party gets a bump after being targeted by IRS,Fox News,right
"As the Senate Spars on Claims, Obama Gets a Report on Russian Hacking",Fox News,right
"Impeachment legal case is ‘woefully inadequate,’ 'dangerous,' legal expert Turley testifies",Fox News,right
Guns and the government ,Fox News,right
OPINION: Donald Trump's Clintonesque foreign policy,Fox News,right
"Obama, Romney face off in Ohio for dueling economic addresses ",Fox News,right
IRS lawyer: Lois Lerner's Blackberry deliberately destroyed after start of congressional probe,Fox News,right
Fox News Republican Debate: Trump's absence leaves three winners and two losers,Fox News,right
Democratic Socialists of America endorses Bernie Sanders despite some members' reservations,Fox News,right
Social media responds to Mitt Romney’s apparent Pierre Delecto Twitter account,Fox News,right
Critical Defense spending bill latest caught in Capitol Hill political divide,Fox News,right
"The Trump Effect? After Carrier pledge to keep jobs in US, more companies may follow",Fox News,right
"Republicans weigh how to broaden base, without resorting to 'gifts'",Fox News,right
"Trump makes biggest ad buy to date, hammers Clinton on economy",Fox News,right
US Embassy compound in Baghdad under siege as crowds protesting airstrikes break through gate,Fox News,right
Donald Ducks,Fox News,right
"Trump to release results of physical, calls candidate health 'an issue' after Clinton incident",Fox News,right
Reid in a bind over bipartisan calls for Keystone vote,Fox News,right
"Dem tensions flare as superdelegates flock to Clinton, even in states Sanders won",Fox News,right
"San Francisco spends about $6,326 for each non-citizen voter to sign up for local election, report says",Fox News,right
Ringling Bros. circus plans to shut down 'Greatest Show on Earth' after 146 years,Fox News,right
Dems race to back Clinton even before 2016 announcement,Fox News,right
Apple to fight order to help hack San Bernardino shooter's phone,Fox News,right
ISIS reportedly enters strategic Syrian town near Turkish border,Fox News,right
"Trump defends talks with Russians, says he shared terror 'facts'",Fox News,right
2018 Midterm Nail-Biter: Battle for control of Congress hinges on dozens of airtight toss-ups,Fox News,right
Michelle Obama leads convention campaign to rekindle the '08 fire,Fox News,right
Senate panel votes to authorize Syria strike,Fox News,right
"Bernie Sanders, at combative Fox News town hall, makes no apologies for making millions",Fox News,right
Romney stays in public eye minus political talk in wake of Sandy  ,Fox News,right
"Comey scoffs at Barr testimony, claims ‘surveillance’ is not ‘spying’",Fox News,right
"US military targets Taliban forces in 'defensive' airstrike, first strike since historic peace deal",Fox News,right
Romney campaign calls Obama remark to business owners 'insulting'  ,Fox News,right
"Nadler says there is 'plenty of evidence of obstruction' in Mueller report, believes Don Jr. should have been charged",Fox News,right
CIA determines Khashoggi’s death was ordered by Saudi Crown Prince Mohammed bin Salman: report,Fox News,right
Justin Trudeau blames privileged upbringing for wearing blackface as new video as third racist incident emerges,Fox News,right
White House's spending cuts? Critics call it creative Washington accounting,Fox News,right
Ukraine president says 'no blackmail' in phone call with Trump,Fox News,right
"Dem AGs mounting Big Tobacco-style probe of oil companies, industry fights back",Fox News,right
"VA vanishes from the media, even as Congress on the verge of passing reform",Fox News,right
"Hurricane Irma shifts to western Florida, expected to strengthen after slamming Cuba",Fox News,right
"Climate report warns of grim economic consequences, worsening weather disasters in US",Fox News,right
"Reckless media inflame BuzzFeed mess, slander Catholic students at protest",Fox News,right
Dems run from Progress Kentucky as group appears to implode in another McConnell attack,Fox News,right
"Trump says Democrats are 'Party of the Squad,' slams media as his 'primary opponent'",Fox News,right
"After UN veto, Kerry suggests Israel's West Bank foray spawning 'terrorism'",Fox News,right
Obama returns to efforts to ban 'assault' weapons,Fox News,right
Mystery solved? Timeline shows how Russian lawyer got into US for Trump Jr. meeting,Fox News,right
Get me rewrite: Are the media dreaming of an Obama comeback?,Fox News,right
"Hiring seen strengthening under Obama, but wages -- not so much",Fox News,right
ObamaCare ruling leaves 2012 candidates taking unexpected sides  ,Fox News,right
Will medical marijuana replace opioids in war on cancer?,Fox News,right
"Presidential rivals trade charges of lying, Romney calls for apology over 'felony' remark",Fox News,right
"Biden wins big in South Carolina primary, in crucial boost for struggling campaign",Fox News,right
"Ryan comes out swinging as Romney VP pick, condemns Obama 'record of failure'",Fox News,right
Supreme Court to hear arguments over challenge to federal law in second of gay marriage cases,Fox News,right
"Clinton rails against big banks, but refuses to release Wall Street speeches",Fox News,right
"San Francisco ‘too permissive’ on public misconduct, says Newsom",Fox News,right
Defense Secretary Carter used personal email in first months on the job,Fox News,right
Obama Drags Bad Jobs Report Along on Bus Tour ,Fox News,right
"More than 200,000 fill Cairo's Tahrir Square to protest Morsi power grab, while crowds clash with police  ",Fox News,right
"Holder takes on Ferguson: AG ‘flooding the zone’ with investigators, heads to Missouri",Fox News,right
OPINION: Why the best outcome now is to keep negotiating without reaching a deal | Fox News,Fox News,right
Obama to announce 10-point immigration plan via exec action as early as next week,Fox News,right
White House says CIA will stop using vaccination programs as cover for operations,Fox News,right
Trump administration reportedly OK's sale of 22 unarmed drones to India,Fox News,right
Obama threatens to wield veto pen to counter GOP-led Congress,Fox News,right
Dems plow ahead with impeachment articles as initial vote looms,Fox News,right
House Democrats reportedly preparing ‘subpoena cannon’ for Trump-related probes,Fox News,right
Trouble for Dems in North Carolina as convention moves into full swing ,Fox News,right
Pope Francis is the Catholic Church's Obama? God help us,Fox News,right
Never-ending Russia probe could fuel GOP's midterm message,Fox News,right
Roberts joins Supreme Court's liberal wing in blocking Louisiana abortion law,Fox News,right
Poll: 71 percent of Dems think Clinton should keep running even if indicted,Fox News,right
"Facebook commits to civil rights audit, probe of alleged anti-conservative bias",Fox News,right
"Leahy says Senate will push for NSA legislation, suggests Obama didn't go far enough",Fox News,right
Hillary Clinton sided with Russia on sanctions as Bill made $500G on Moscow speech,Fox News,right
Republicans revive 'Penny Plan' as sequester alternative to balance budget,Fox News,right
Coverage worries grow as ObamaCare cliff nears,Fox News,right
"What Christie, McAuliffe victories mean for America",Fox News,right
"Debt ceiling, government shutdown battles simmer in summer recess",Fox News,right
"Trump call to Putin could include discussion about future relations, sanctions",Fox News,right
Dallas hospital reportedly failed to follow federal guidelines by sending Ebola patient home,Fox News,right
Tea Party activists may keep low profile at first GOP convention ,Fox News,right
Hate crime charges filed in Chicago beating streamed on Facebook Live,Fox News,right
Trump takes swipe at FBI Director Wray for ‘protecting’ Russia probe ‘gang’,Fox News,right
